
    =========================== USB Port1 ===========================

Connection Status        : 0x01 (Device is connected)
Port Chain               : 1-1-1
Properties               : 0x00
 IsUserConnectable       : no
 PortIsDebugCapable      : no
 PortHasMultiCompanions  : no
 PortConnectorIsTypeC    : no
ConnectionIndex          : 0x01 (Port 1)

      ========================== Summary =========================
Vendor ID                : 0x046D (Logitech Inc.)
Product ID               : 0xC0A0
Manufacturer String      : "Logitech"
Product String           : "PRO X 2 DEX"
Serial                   : "124626B5"
USB Version              : 2.0 (but 12 Mbit/s FullSpeed only)
Port maximum Speed       : High-Speed
Device maximum Speed     : Full-Speed
Device Connection Speed  : Full-Speed
Self powered             : yes
Demanded Current         : 500 mA
Used Endpoints           : 4

      ======================== USB Device ========================

        +++++++++++++++++ Device Information ++++++++++++++++++
Device Description       : Составное USB устройство
Device Path 1            : \\?\USB#VID_046D&PID_C0A0#124626B5#{a5dcbf10-6530-11d2-901f-00c04fb951ed} (GUID_DEVINTERFACE_USB_DEVICE)
Device Path 2            : \\?\USB#VID_046D&PID_C0A0#124626B5#{a6782bce-4376-4de2-8096-70aa9e8fed19}
Kernel Name              : \Device\USBPDO-13
Device ID                : USB\VID_046D&PID_C0A0\124626B5
Hardware IDs             : USB\VID_046D&PID_C0A0&REV_3701 USB\VID_046D&PID_C0A0
Driver KeyName           : {36fc9e60-c465-11cf-8056-444553540000}\0017 (GUID_DEVCLASS_USB)
Driver                   : \SystemRoot\System32\drivers\usbccgp.sys (Version: 10.0.26100.7262  Date: 2025-11-18  Company: Microsoft Corporation)
Driver Inf               : C:\WINDOWS\inf\usb.inf
Legacy BusType           : PNPBus
Class                    : USB
Class GUID               : {36fc9e60-c465-11cf-8056-444553540000} (GUID_DEVCLASS_USB)
Service                  : usbccgp
Enumerator               : USB
Location Info            : Port_#0001.Hub_#0004
Address                  : 1
Location IDs             : PCIROOT(0)#PCI(0801)#PCI(0004)#USBROOT(0)#USB(1)#USB(1), ACPI(_SB_)#ACPI(PCI0)#ACPI(GP17)#ACPI(XHC1)#ACPI(RHUB)#ACPI(PRT1)#USB(1)
Container ID             : {d248cb78-5acd-5421-9641-8d7ce08db237}
Manufacturer Info        : (Стандартный USB хост-контроллер)
Capabilities             : 0x94 (Removable, UniqueID, SurpriseRemovalOK)
Status                   : 0x0180400A (DN_DRIVER_LOADED, DN_STARTED, DN_REMOVABLE, DN_NT_ENUMERATOR, DN_NT_DRIVER)
Problem Code             : 0
Address                  : 1
SelectiveSuspendEnabled  : 0
EnhancedPowerMgmtEnabled : 1
Power State              : D0 (supported: D0, D1, D2, D3, wake from D0, wake from D1, wake from D2)

        +++++++++++++++++ Registry USB Flags +++++++++++++++++
HKEY_LOCAL_MACHINE\SYSTEM\CurrentControlSet\Control\usbflags\046DC0A03701
 osvc                    : REG_BINARY 00 00

        ---------------- Connection Information ---------------
Connection Index         : 0x01 (Port 1)
Connection Status        : 0x01 (DeviceConnected)
Current Config Value     : 0x01 (Configuration 1)
Device Address           : 0x06 (6)
Is Hub                   : 0x00 (no)
Device Bus Speed         : 0x01 (Full-Speed)
Number of open Pipes     : 0x03 (3 pipes to data endpoints)
Pipe[0]                  : EndpointID=1  Direction=IN   ScheduleOffset=0  Type=Interrupt  wMaxPacketSize=0x40    bInterval=1   -> 718 Bits/ms = 89750 Bytes/s
Pipe[1]                  : EndpointID=2  Direction=IN   ScheduleOffset=0  Type=Interrupt  wMaxPacketSize=0x40    bInterval=1   -> 718 Bits/ms = 89750 Bytes/s
Pipe[2]                  : EndpointID=3  Direction=IN   ScheduleOffset=0  Type=Interrupt  wMaxPacketSize=0x40    bInterval=1   -> 718 Bits/ms = 89750 Bytes/s
Data (HexDump)           : 01 00 00 00 12 01 00 02 00 00 00 40 6D 04 A0 C0   ...........@m...
                           01 37 01 02 03 01 01 01 00 06 00 03 00 00 00 01   .7..............
                           00 00 00 07 05 81 03 40 00 01 00 00 00 00 07 05   .......@........
                           82 03 40 00 01 00 00 00 00 07 05 83 03 40 00 01   ..@..........@..
                           00 00 00 00                                       ....

        --------------- Connection Information V2 -------------
Connection Index         : 0x01 (1)
Length                   : 0x10 (16 bytes)
SupportedUsbProtocols    : 0x03
 Usb110                  : 1 (yes, port supports USB 1.1)
 Usb200                  : 1 (yes, port supports USB 2.0)
 Usb300                  : 0 (no, port not supports USB 3.0)
 ReservedMBZ             : 0x00
Flags                    : 0x00
 DevIsOpAtSsOrHigher     : 0 (Device is not operating at SuperSpeed or higher)
 DevIsSsCapOrHigher      : 0 (Device is not SuperSpeed capable or higher)
 DevIsOpAtSsPlusOrHigher : 0 (Device is not operating at SuperSpeedPlus or higher)
 DevIsSsPlusCapOrHigher  : 0 (Device is not SuperSpeedPlus capable or higher)
 ReservedMBZ             : 0x00
Data (HexDump)           : 01 00 00 00 10 00 00 00 03 00 00 00 00 00 00 00   ................

    ---------------------- Device Descriptor ----------------------
bLength                  : 0x12 (18 bytes)
bDescriptorType          : 0x01 (Device Descriptor)
bcdUSB                   : 0x200 (USB Version 2.0) -> but device is Full-Speed only
bDeviceClass             : 0x00 (defined by the interface descriptors)
bDeviceSubClass          : 0x00
bDeviceProtocol          : 0x00
bMaxPacketSize0          : 0x40 (64 bytes)
idVendor                 : 0x046D (Logitech Inc.)
idProduct                : 0xC0A0
bcdDevice                : 0x3701
iManufacturer            : 0x01 (String Descriptor 1)
 Language 0x0409         : "Logitech"
iProduct                 : 0x02 (String Descriptor 2)
 Language 0x0409         : "PRO X 2 DEX"
iSerialNumber            : 0x03 (String Descriptor 3)
 Language 0x0409         : "124626B5"
bNumConfigurations       : 0x01 (1 Configuration)
Data (HexDump)           : 12 01 00 02 00 00 00 40 6D 04 A0 C0 01 37 01 02   .......@m....7..
                           03 01                                             ..

    ------------------ Configuration Descriptor -------------------
bLength                  : 0x09 (9 bytes)
bDescriptorType          : 0x02 (Configuration Descriptor)
wTotalLength             : 0x0054 (84 bytes)
bNumInterfaces           : 0x03 (3 Interfaces)
bConfigurationValue      : 0x01 (Configuration 1)
iConfiguration           : 0x04 (String Descriptor 4)
 Language 0x0409         : "MPM37.01_B0005"
bmAttributes             : 0xE0
 D7: Reserved, set 1     : 0x01
 D6: Self Powered        : 0x01 (yes)
 D5: Remote Wakeup       : 0x01 (yes)
 D4..0: Reserved, set 0  : 0x00
MaxPower                 : 0xFA (500 mA)
Data (HexDump)           : 09 02 54 00 03 01 04 E0 FA 09 04 00 00 01 03 01   ..T.............
                           02 00 09 21 11 01 00 01 22 53 00 07 05 81 03 40   ...!...."S.....@
                           00 01 09 04 01 00 01 03 01 01 00 09 21 11 01 00   ............!...
                           01 22 7D 00 07 05 82 03 40 00 01 09 04 02 00 01   ."}.....@.......
                           03 00 00 00 09 21 11 01 00 01 22 36 00 07 05 83   .....!...."6....
                           03 40 00 01                                       .@..

        ---------------- Interface Descriptor -----------------
bLength                  : 0x09 (9 bytes)
bDescriptorType          : 0x04 (Interface Descriptor)
bInterfaceNumber         : 0x00 (Interface 0)
bAlternateSetting        : 0x00
bNumEndpoints            : 0x01 (1 Endpoint)
bInterfaceClass          : 0x03 (HID - Human Interface Device)
bInterfaceSubClass       : 0x01 (Boot Interface)
bInterfaceProtocol       : 0x02 (Mouse)
iInterface               : 0x00 (No String Descriptor)
Data (HexDump)           : 09 04 00 00 01 03 01 02 00                        .........

        ------------------- HID Descriptor --------------------
bLength                  : 0x09 (9 bytes)
bDescriptorType          : 0x21 (HID Descriptor)
bcdHID                   : 0x0111 (HID Version 1.11)
bCountryCode             : 0x00 (00 = not localized)
bNumDescriptors          : 0x01
Data (HexDump)           : 09 21 11 01 00 01 22 53 00                        .!...."S.
Descriptor 1:
bDescriptorType          : 0x22 (Class=Report)
wDescriptorLength        : 0x0053 (83 bytes)
Error reading descriptor : ERROR_GEN_FAILURE (due to a obscure limitation of the Win32 USB API, see F1 Help)

        ----------------- Endpoint Descriptor -----------------
bLength                  : 0x07 (7 bytes)
bDescriptorType          : 0x05 (Endpoint Descriptor)
bEndpointAddress         : 0x81 (Direction=IN EndpointID=1)
bmAttributes             : 0x03 (TransferType=Interrupt)
wMaxPacketSize           : 0x0040 (64 bytes)
bInterval                : 0x01 (1 ms)
Data (HexDump)           : 07 05 81 03 40 00 01                              ....@..

        ---------------- Interface Descriptor -----------------
bLength                  : 0x09 (9 bytes)
bDescriptorType          : 0x04 (Interface Descriptor)
bInterfaceNumber         : 0x01 (Interface 1)
bAlternateSetting        : 0x00
bNumEndpoints            : 0x01 (1 Endpoint)
bInterfaceClass          : 0x03 (HID - Human Interface Device)
bInterfaceSubClass       : 0x01 (Boot Interface)
bInterfaceProtocol       : 0x01 (Keyboard)
iInterface               : 0x00 (No String Descriptor)
Data (HexDump)           : 09 04 01 00 01 03 01 01 00                        .........

        ------------------- HID Descriptor --------------------
bLength                  : 0x09 (9 bytes)
bDescriptorType          : 0x21 (HID Descriptor)
bcdHID                   : 0x0111 (HID Version 1.11)
bCountryCode             : 0x00 (00 = not localized)
bNumDescriptors          : 0x01
Data (HexDump)           : 09 21 11 01 00 01 22 7D 00                        .!...."}.
Descriptor 1:
bDescriptorType          : 0x22 (Class=Report)
wDescriptorLength        : 0x007D (125 bytes)
Error reading descriptor : ERROR_GEN_FAILURE (due to a obscure limitation of the Win32 USB API, see F1 Help)

        ----------------- Endpoint Descriptor -----------------
bLength                  : 0x07 (7 bytes)
bDescriptorType          : 0x05 (Endpoint Descriptor)
bEndpointAddress         : 0x82 (Direction=IN EndpointID=2)
bmAttributes             : 0x03 (TransferType=Interrupt)
wMaxPacketSize           : 0x0040 (64 bytes)
bInterval                : 0x01 (1 ms)
Data (HexDump)           : 07 05 82 03 40 00 01                              ....@..

        ---------------- Interface Descriptor -----------------
bLength                  : 0x09 (9 bytes)
bDescriptorType          : 0x04 (Interface Descriptor)
bInterfaceNumber         : 0x02 (Interface 2)
bAlternateSetting        : 0x00
bNumEndpoints            : 0x01 (1 Endpoint)
bInterfaceClass          : 0x03 (HID - Human Interface Device)
bInterfaceSubClass       : 0x00 (None)
bInterfaceProtocol       : 0x00 (None)
iInterface               : 0x00 (No String Descriptor)
Data (HexDump)           : 09 04 02 00 01 03 00 00 00                        .........

        ------------------- HID Descriptor --------------------
bLength                  : 0x09 (9 bytes)
bDescriptorType          : 0x21 (HID Descriptor)
bcdHID                   : 0x0111 (HID Version 1.11)
bCountryCode             : 0x00 (00 = not localized)
bNumDescriptors          : 0x01
Data (HexDump)           : 09 21 11 01 00 01 22 36 00                        .!...."6.
Descriptor 1:
bDescriptorType          : 0x22 (Class=Report)
wDescriptorLength        : 0x0036 (54 bytes)
Error reading descriptor : ERROR_GEN_FAILURE (due to a obscure limitation of the Win32 USB API, see F1 Help)

        ----------------- Endpoint Descriptor -----------------
bLength                  : 0x07 (7 bytes)
bDescriptorType          : 0x05 (Endpoint Descriptor)
bEndpointAddress         : 0x83 (Direction=IN EndpointID=3)
bmAttributes             : 0x03 (TransferType=Interrupt)
wMaxPacketSize           : 0x0040 (64 bytes)
bInterval                : 0x01 (1 ms)
Data (HexDump)           : 07 05 83 03 40 00 01                              ....@..

    ----------------- Device Qualifier Descriptor -----------------
Error                    : ERROR_GEN_FAILURE  (because the device is Full-Speed only)

      -------------------- String Descriptors -------------------
             ------ String Descriptor 0 ------
bLength                  : 0x04 (4 bytes)
bDescriptorType          : 0x03 (String Descriptor)
Language ID[0]           : 0x0409 (English - United States)
Data (HexDump)           : 04 03 09 04                                       ....
             ------ String Descriptor 1 ------
bLength                  : 0x12 (18 bytes)
bDescriptorType          : 0x03 (String Descriptor)
Language 0x0409          : "Logitech"
Data (HexDump)           : 12 03 4C 00 6F 00 67 00 69 00 74 00 65 00 63 00   ..L.o.g.i.t.e.c.
                           68 00                                             h.
             ------ String Descriptor 2 ------
bLength                  : 0x18 (24 bytes)
bDescriptorType          : 0x03 (String Descriptor)
Language 0x0409          : "PRO X 2 DEX"
Data (HexDump)           : 18 03 50 00 52 00 4F 00 20 00 58 00 20 00 32 00   ..P.R.O. .X. .2.
                           20 00 44 00 45 00 58 00                            .D.E.X.
             ------ String Descriptor 3 ------
bLength                  : 0x12 (18 bytes)
bDescriptorType          : 0x03 (String Descriptor)
Language 0x0409          : "124626B5"
Data (HexDump)           : 12 03 31 00 32 00 34 00 36 00 32 00 36 00 42 00   ..1.2.4.6.2.6.B.
                           35 00                                             5.
             ------ String Descriptor 4 ------
bLength                  : 0x1E (30 bytes)
bDescriptorType          : 0x03 (String Descriptor)
Language 0x0409          : "MPM37.01_B0005"
Data (HexDump)           : 1E 03 4D 00 50 00 4D 00 33 00 37 00 2E 00 30 00   ..M.P.M.3.7...0.
                           31 00 5F 00 42 00 30 00 30 00 30 00 35 00         1._.B.0.0.0.5.

        +++++++++++++++++ Device Information ++++++++++++++++++
Device Description       : USB-устройство ввода
Device Path              : \\?\USB#VID_046D&PID_C0A0&MI_00#8&1cbf186&1&0000#{a6782bce-4376-4de2-8096-70aa9e8fed19}
Kernel Name              : \Device\00000160
Device ID                : USB\VID_046D&PID_C0A0&MI_00\8&1CBF186&1&0000
Hardware IDs             : USB\VID_046D&PID_C0A0&REV_3701&MI_00 USB\VID_046D&PID_C0A0&MI_00
Driver KeyName           : {745a17a0-74d3-11d0-b6fe-00a0c90f57da}\0040 (GUID_DEVCLASS_HIDCLASS)
Driver                   : \SystemRoot\System32\drivers\hidusb.sys (Version: 10.0.26100.7262  Date: 2025-11-18  Company: Microsoft Corporation)
Driver Inf               : C:\WINDOWS\inf\input.inf
Legacy BusType           : PNPBus
Class                    : HIDClass
Class GUID               : {745a17a0-74d3-11d0-b6fe-00a0c90f57da} (GUID_DEVCLASS_HIDCLASS)
Service                  : HidUsb
Enumerator               : USB
Location Info            : 0004.0000.0004.001.001.000.000.000.000
Address                  : 1
Manufacturer Info        : (Стандартные системные устройства)
Capabilities             : 0x80 (SurpriseRemovalOK)
Status                   : 0x0180200A (DN_DRIVER_LOADED, DN_STARTED, DN_DISABLEABLE, DN_NT_ENUMERATOR, DN_NT_DRIVER)
Problem Code             : 0
SelectiveSuspendEnabled  : 0
EnhancedPowerMgmtEnabled : 1
Power State              : D0 (supported: D0, D1, D2, D3, wake from D0, wake from D1, wake from D2)

        +++++++++++++++++ Device Information ++++++++++++++++++
Device Description       : HID-совместимая мышь
Device Path 1            : \\?\HID#VID_046D&PID_C0A0&MI_00#9&2fb7db9c&0&0000#{378de44c-56ef-11d1-bc8c-00a0c91405dd} (GUID_DEVINTERFACE_MOUSE)
Device Path 2            : \\?\HID#VID_046D&PID_C0A0&MI_00#9&2fb7db9c&0&0000#{4d1e55b2-f16f-11cf-88cb-001111000030} (GUID_DEVINTERFACE_HID)
Kernel Name              : \Device\00000163
Device ID                : HID\VID_046D&PID_C0A0&MI_00\9&2FB7DB9C&0&0000
Hardware IDs             : HID\VID_046D&PID_C0A0&REV_3701&MI_00 HID\VID_046D&PID_C0A0&MI_00 HID\VID_046D&UP:0001_U:0002 HID_DEVICE_SYSTEM_MOUSE HID_DEVICE_UP:0001_U:0002 HID_DEVICE
Driver KeyName           : {4d36e96f-e325-11ce-bfc1-08002be10318}\0016 (GUID_DEVCLASS_MOUSE)
Driver                   : \SystemRoot\System32\drivers\mouhid.sys (Version: 10.0.26100.1150  Date: 2025-11-06  Company: Microsoft Corporation)
Driver Inf               : C:\WINDOWS\inf\msmouse.inf
Legacy BusType           : PNPBus
Class                    : Mouse
Class GUID               : {4d36e96f-e325-11ce-bfc1-08002be10318} (GUID_DEVCLASS_MOUSE)
Service                  : mouhid
Enumerator               : HID
Location Info            : -
Address                  : 1
Manufacturer Info        : Microsoft
Capabilities             : 0xA0 (SilentInstall, SurpriseRemovalOK)
Status                   : 0x0180200A (DN_DRIVER_LOADED, DN_STARTED, DN_DISABLEABLE, DN_NT_ENUMERATOR, DN_NT_DRIVER)
Problem Code             : 0
EnhancedPowerMgmtEnabled : 0
Power State              : D0 (supported: D0, D1, D2, D3, wake from D0, wake from D1, wake from D2)

             +++++++++++++ Mouse Information ++++++++++++++
Input Data Queue Length  : 2
Mouse Identifier         : 256
Number of Buttons        : 16
Sample Rate              : 0

             ++++++++++++++ HID Information +++++++++++++++
Manufacturer             : Logitech
Product                  : PRO X 2 DEX
Serial Number            : 124626B5
UsagePage                : 0x01 (Generic Desktop Controls)
Usage                    : 0x02 (Mouse)

        +++++++++++++++++ Device Information ++++++++++++++++++
Device Description       : USB-устройство ввода
Device Path              : \\?\USB#VID_046D&PID_C0A0&MI_01#8&1cbf186&1&0001#{a6782bce-4376-4de2-8096-70aa9e8fed19}
Kernel Name              : \Device\00000161
Device ID                : USB\VID_046D&PID_C0A0&MI_01\8&1CBF186&1&0001
Hardware IDs             : USB\VID_046D&PID_C0A0&REV_3701&MI_01 USB\VID_046D&PID_C0A0&MI_01
Driver KeyName           : {745a17a0-74d3-11d0-b6fe-00a0c90f57da}\0046 (GUID_DEVCLASS_HIDCLASS)
Driver                   : \SystemRoot\System32\drivers\hidusb.sys (Version: 10.0.26100.7262  Date: 2025-11-18  Company: Microsoft Corporation)
Driver Inf               : C:\WINDOWS\inf\input.inf
Legacy BusType           : PNPBus
Class                    : HIDClass
Class GUID               : {745a17a0-74d3-11d0-b6fe-00a0c90f57da} (GUID_DEVCLASS_HIDCLASS)
Service                  : HidUsb
Enumerator               : USB
Location Info            : 0004.0000.0004.001.001.000.000.000.000
Address                  : 2
Manufacturer Info        : (Стандартные системные устройства)
Capabilities             : 0x80 (SurpriseRemovalOK)
Status                   : 0x0180000A (DN_DRIVER_LOADED, DN_STARTED, DN_NT_ENUMERATOR, DN_NT_DRIVER)
Problem Code             : 0
SelectiveSuspendEnabled  : 0
EnhancedPowerMgmtEnabled : 1
Power State              : D0 (supported: D0, D1, D2, D3, wake from D0, wake from D1, wake from D2)

        +++++++++++++++++ Device Information ++++++++++++++++++
Device Description       : HID-совместимое устройство управления
Device Path              : \\?\HID#VID_046D&PID_C0A0&MI_01&Col02#9&1c87bf5e&0&0001#{4d1e55b2-f16f-11cf-88cb-001111000030} (GUID_DEVINTERFACE_HID)
Kernel Name              : \Device\00000165
Device ID                : HID\VID_046D&PID_C0A0&MI_01&COL02\9&1C87BF5E&0&0001
Hardware IDs             : HID\VID_046D&PID_C0A0&REV_3701&MI_01&Col02 HID\VID_046D&PID_C0A0&MI_01&Col02 HID\VID_046D&UP:000C_U:0001 HID_DEVICE_SYSTEM_CONSUMER HID_DEVICE_UP:000C_U:0001 HID_DEVICE
Driver KeyName           : {745a17a0-74d3-11d0-b6fe-00a0c90f57da}\0048 (GUID_DEVCLASS_HIDCLASS)
Driver Inf               : C:\WINDOWS\inf\hidserv.inf
Legacy BusType           : PNPBus
Class                    : HIDClass
Class GUID               : {745a17a0-74d3-11d0-b6fe-00a0c90f57da} (GUID_DEVCLASS_HIDCLASS)
Enumerator               : HID
Location Info            : -
Address                  : 2
Manufacturer Info        : Microsoft
Capabilities             : 0xE0 (SilentInstall, RawDeviceOK, SurpriseRemovalOK)
Status                   : 0x0180200A (DN_DRIVER_LOADED, DN_STARTED, DN_DISABLEABLE, DN_NT_ENUMERATOR, DN_NT_DRIVER)
Problem Code             : 0
EnhancedPowerMgmtEnabled : 0
Power State              : D0 (supported: D0, D1, D2, D3, wake from D0, wake from D1, wake from D2)

             ++++++++++++++ HID Information +++++++++++++++
Manufacturer             : Logitech
Product                  : PRO X 2 DEX
Serial Number            : 124626B5
UsagePage                : 0x0C (Consumer)
Usage                    : 0x01 (Consumer Control)

        +++++++++++++++++ Device Information ++++++++++++++++++
Device Description       : HID-совместимый системный контроллер
Device Path 1            : \\?\HID#VID_046D&PID_C0A0&MI_01&Col03#9&1c87bf5e&0&0002#{4afa3d53-74a7-11d0-be5e-00a0c9062857} (GUID_DEVICE_SYS_BUTTON)
Device Path 2            : \\?\HID#VID_046D&PID_C0A0&MI_01&Col03#9&1c87bf5e&0&0002#{4d1e55b2-f16f-11cf-88cb-001111000030} (GUID_DEVINTERFACE_HID)
Kernel Name              : \Device\00000166
Device ID                : HID\VID_046D&PID_C0A0&MI_01&COL03\9&1C87BF5E&0&0002
Hardware IDs             : HID\VID_046D&PID_C0A0&REV_3701&MI_01&Col03 HID\VID_046D&PID_C0A0&MI_01&Col03 HID\VID_046D&UP:0001_U:0080 HID_DEVICE_SYSTEM_CONTROL HID_DEVICE_UP:0001_U:0080 HID_DEVICE
Driver KeyName           : {745a17a0-74d3-11d0-b6fe-00a0c90f57da}\0049 (GUID_DEVCLASS_HIDCLASS)
Driver Inf               : C:\WINDOWS\inf\input.inf
Legacy BusType           : PNPBus
Class                    : HIDClass
Class GUID               : {745a17a0-74d3-11d0-b6fe-00a0c90f57da} (GUID_DEVCLASS_HIDCLASS)
Enumerator               : HID
Location Info            : -
Address                  : 3
Manufacturer Info        : (Стандартные системные устройства)
Capabilities             : 0xE0 (SilentInstall, RawDeviceOK, SurpriseRemovalOK)
Status                   : 0x0180200A (DN_DRIVER_LOADED, DN_STARTED, DN_DISABLEABLE, DN_NT_ENUMERATOR, DN_NT_DRIVER)
Problem Code             : 0
EnhancedPowerMgmtEnabled : 0
Power State              : D0 (supported: D0, D1, D2, D3, wake from D0, wake from D1, wake from D2)

             ++++++++++++++ HID Information +++++++++++++++
Manufacturer             : Logitech
Product                  : PRO X 2 DEX
Serial Number            : 124626B5
UsagePage                : 0x01 (Generic Desktop Controls)
Usage                    : 0x80 (System Control)

        +++++++++++++++++ Device Information ++++++++++++++++++
Device Description       : Клавиатура HID
Device Path 1            : \\?\HID#VID_046D&PID_C0A0&MI_01&Col01#9&1c87bf5e&0&0000#{4d1e55b2-f16f-11cf-88cb-001111000030}\kbd (GUID_DEVINTERFACE_HID)
Device Path 2            : \\?\HID#VID_046D&PID_C0A0&MI_01&Col01#9&1c87bf5e&0&0000#{884b96c3-56ef-11d1-bc8c-00a0c91405dd} (GUID_DEVINTERFACE_KEYBOARD)
Kernel Name              : \Device\00000164
Device ID                : HID\VID_046D&PID_C0A0&MI_01&COL01\9&1C87BF5E&0&0000
Hardware IDs             : HID\VID_046D&PID_C0A0&REV_3701&MI_01&Col01 HID\VID_046D&PID_C0A0&MI_01&Col01 HID\VID_046D&UP:0001_U:0006 HID_DEVICE_SYSTEM_KEYBOARD HID_DEVICE_UP:0001_U:0006 HID_DEVICE
Driver KeyName           : {4d36e96b-e325-11ce-bfc1-08002be10318}\0010 (GUID_DEVCLASS_KEYBOARD)
Driver                   : \SystemRoot\System32\drivers\kbdhid.sys (Version: 10.0.26100.1930  Date: 2025-11-06  Company: Microsoft Corporation)
Driver Inf               : C:\WINDOWS\inf\keyboard.inf
Legacy BusType           : PNPBus
Class                    : Keyboard
Class GUID               : {4d36e96b-e325-11ce-bfc1-08002be10318} (GUID_DEVCLASS_KEYBOARD)
Service                  : kbdhid
Enumerator               : HID
Location Info            : -
Address                  : 1
Manufacturer Info        : (Стандартные клавиатуры)
Capabilities             : 0xA0 (SilentInstall, SurpriseRemovalOK)
Status                   : 0x0180000A (DN_DRIVER_LOADED, DN_STARTED, DN_NT_ENUMERATOR, DN_NT_DRIVER)
Problem Code             : 0
EnhancedPowerMgmtEnabled : 0
Power State              : D0 (supported: D0, D1, D2, D3, wake from D0, wake from D1, wake from D2)

             ++++++++++++ Keyboad Information +++++++++++++
Keyboard ID.Type         : 0x51 (HID)
Keyboard ID.Subtype      : 0
Keyboard Mode            : 1
Number of Function Keys  : 12
Number of Indicators     : 3
Number of Keys Total     : 264
Input Data Queue Length  : 1
Key Repeat Minimum.UnitId: 8
Key Repeat Minimum.Rate  : 2 per second
Key Repeat Minimum.Delay : 250 ms
Key Repeat Maximum.UnitId: 8
Key Repeat Maximum.Rate  : 30 per second
Key Repeat Maximum.Delay : 1000 ms
Key Repeat UnitId        : 0
Key Repeat Rate          : 30 per second
Key Repeat Delay         : 500 ms

             ++++++++++++++ HID Information +++++++++++++++
Manufacturer             : Logitech
Product                  : PRO X 2 DEX
Serial Number            : 124626B5
UsagePage                : 0x01 (Generic Desktop Controls)
Usage                    : 0x06 (Keyboard)

        +++++++++++++++++ Device Information ++++++++++++++++++
Device Description       : USB-устройство ввода
Device Path              : \\?\USB#VID_046D&PID_C0A0&MI_02#8&1cbf186&1&0002#{a6782bce-4376-4de2-8096-70aa9e8fed19}
Kernel Name              : \Device\00000162
Device ID                : USB\VID_046D&PID_C0A0&MI_02\8&1CBF186&1&0002
Hardware IDs             : USB\VID_046D&PID_C0A0&REV_3701&MI_02 USB\VID_046D&PID_C0A0&MI_02
Driver KeyName           : {745a17a0-74d3-11d0-b6fe-00a0c90f57da}\0047 (GUID_DEVCLASS_HIDCLASS)
Driver                   : \SystemRoot\System32\drivers\hidusb.sys (Version: 10.0.26100.7262  Date: 2025-11-18  Company: Microsoft Corporation)
Driver Inf               : C:\WINDOWS\inf\input.inf
Legacy BusType           : PNPBus
Class                    : HIDClass
Class GUID               : {745a17a0-74d3-11d0-b6fe-00a0c90f57da} (GUID_DEVCLASS_HIDCLASS)
Service                  : HidUsb
Enumerator               : USB
Location Info            : 0004.0000.0004.001.001.000.000.000.000
Address                  : 3
Manufacturer Info        : (Стандартные системные устройства)
Capabilities             : 0x80 (SurpriseRemovalOK)
Status                   : 0x0180200A (DN_DRIVER_LOADED, DN_STARTED, DN_DISABLEABLE, DN_NT_ENUMERATOR, DN_NT_DRIVER)
Problem Code             : 0
SelectiveSuspendEnabled  : 0
EnhancedPowerMgmtEnabled : 1
Power State              : D0 (supported: D0, D1, D2, D3, wake from D0, wake from D1, wake from D2)

        +++++++++++++++++ Device Information ++++++++++++++++++
Device Description       : HID-совместимое устройство, определенное поставщиком
Device Path              : \\?\HID#VID_046D&PID_C0A0&MI_02&Col01#9&957a320&0&0000#{4d1e55b2-f16f-11cf-88cb-001111000030} (GUID_DEVINTERFACE_HID)
Kernel Name              : \Device\00000167
Device ID                : HID\VID_046D&PID_C0A0&MI_02&COL01\9&957A320&0&0000
Hardware IDs             : HID\VID_046D&PID_C0A0&REV_3701&MI_02&Col01 HID\VID_046D&PID_C0A0&MI_02&Col01 HID\VID_046D&UP:FF00_U:0001 HID_DEVICE_UP:FF00_U:0001 HID_DEVICE_UPR:FF00-FFFF HID_DEVICE
Driver KeyName           : {745a17a0-74d3-11d0-b6fe-00a0c90f57da}\0050 (GUID_DEVCLASS_HIDCLASS)
Driver Inf               : C:\WINDOWS\inf\input.inf
Legacy BusType           : PNPBus
Class                    : HIDClass
Class GUID               : {745a17a0-74d3-11d0-b6fe-00a0c90f57da} (GUID_DEVCLASS_HIDCLASS)
Enumerator               : HID
Location Info            : -
Address                  : 1
Manufacturer Info        : (Стандартные системные устройства)
Capabilities             : 0xE0 (SilentInstall, RawDeviceOK, SurpriseRemovalOK)
Status                   : 0x0180200A (DN_DRIVER_LOADED, DN_STARTED, DN_DISABLEABLE, DN_NT_ENUMERATOR, DN_NT_DRIVER)
Problem Code             : 0
EnhancedPowerMgmtEnabled : 0
Power State              : D0 (supported: D0, D1, D2, D3, wake from D0, wake from D1, wake from D2)

             ++++++++++++++ HID Information +++++++++++++++
Manufacturer             : Logitech
Product                  : PRO X 2 DEX
Serial Number            : 124626B5
UsagePage                : 0xFF00 (Vendor Defined)
Usage                    : 0x01 (unk)

        +++++++++++++++++ Device Information ++++++++++++++++++
Device Description       : HID-совместимое устройство, определенное поставщиком
Device Path              : \\?\HID#VID_046D&PID_C0A0&MI_02&Col02#9&957a320&0&0001#{4d1e55b2-f16f-11cf-88cb-001111000030} (GUID_DEVINTERFACE_HID)
Kernel Name              : \Device\00000168
Device ID                : HID\VID_046D&PID_C0A0&MI_02&COL02\9&957A320&0&0001
Hardware IDs             : HID\VID_046D&PID_C0A0&REV_3701&MI_02&Col02 HID\VID_046D&PID_C0A0&MI_02&Col02 HID\VID_046D&UP:FF00_U:0002 HID_DEVICE_UP:FF00_U:0002 HID_DEVICE_UPR:FF00-FFFF HID_DEVICE
Driver KeyName           : {745a17a0-74d3-11d0-b6fe-00a0c90f57da}\0051 (GUID_DEVCLASS_HIDCLASS)
Driver Inf               : C:\WINDOWS\inf\input.inf
Legacy BusType           : PNPBus
Class                    : HIDClass
Class GUID               : {745a17a0-74d3-11d0-b6fe-00a0c90f57da} (GUID_DEVCLASS_HIDCLASS)
Enumerator               : HID
Location Info            : -
Address                  : 2
Manufacturer Info        : (Стандартные системные устройства)
Capabilities             : 0xE0 (SilentInstall, RawDeviceOK, SurpriseRemovalOK)
Status                   : 0x0180200A (DN_DRIVER_LOADED, DN_STARTED, DN_DISABLEABLE, DN_NT_ENUMERATOR, DN_NT_DRIVER)
Problem Code             : 0
EnhancedPowerMgmtEnabled : 0
Power State              : D0 (supported: D0, D1, D2, D3, wake from D0, wake from D1, wake from D2)

             ++++++++++++++ HID Information +++++++++++++++
Manufacturer             : Logitech
Product                  : PRO X 2 DEX
Serial Number            : 124626B5
UsagePage                : 0xFF00 (Vendor Defined)
Usage                    : 0x02 (unk)
