
    =========================== USB Port2 ===========================

Connection Status        : 0x01 (Device is connected)
Port Chain               : 2-2
Properties               : 0x01
 IsUserConnectable       : yes
 PortIsDebugCapable      : no
 PortHasMultiCompanions  : no
 PortConnectorIsTypeC    : no
ConnectionIndex          : 0x02 (Port 2)
CompanionIndex           : 0
 CompanionHubSymLnk      : USB#ROOT_HUB30#5&315b279c&0&0#{f18a0e88-c30c-11d0-8815-00a0c906bed8}
 CompanionPortNumber     : 0x06 (Port 6)
 -> CompanionPortChain   : 2-6

      ========================== Summary =========================
Vendor ID                : 0x24AE (Shenzhen Rapoo Technology Co., Ltd.)
Product ID               : 0x2013
Manufacturer String      : "RAPOO"
Product String           : "Rapoo 2.4G Wireless Device"
Serial                   : ---
USB Version              : 2.0 (but 12 Mbit/s FullSpeed only)
Port maximum Speed       : High-Speed (Companion Port 2-6 is doing the SuperSpeed)
Device maximum Speed     : Full-Speed
Device Connection Speed  : Full-Speed
Self powered             : no
Demanded Current         : 100 mA
Used Endpoints           : 4

      ======================== USB Device ========================

        +++++++++++++++++ Device Information ++++++++++++++++++
Device Description       : Составное USB устройство
Device Path 1            : \\?\USB#VID_24AE&PID_2013#6&5280d8e&0&2#{a5dcbf10-6530-11d2-901f-00c04fb951ed} (GUID_DEVINTERFACE_USB_DEVICE)
Device Path 2            : \\?\USB#VID_24AE&PID_2013#6&5280d8e&0&2#{a6782bce-4376-4de2-8096-70aa9e8fed19}
Kernel Name              : \Device\USBPDO-77
Device ID                : USB\VID_24AE&PID_2013\6&5280D8E&0&2
Hardware IDs             : USB\VID_24AE&PID_2013&REV_0110 USB\VID_24AE&PID_2013
Driver KeyName           : {36fc9e60-c465-11cf-8056-444553540000}\0029 (GUID_DEVCLASS_USB)
Driver                   : \SystemRoot\System32\drivers\usbccgp.sys (Version: 10.0.26100.7262  Date: 2025-11-18  Company: Microsoft Corporation)
Driver Inf               : C:\WINDOWS\inf\usb.inf
Legacy BusType           : PNPBus
Class                    : USB
Class GUID               : {36fc9e60-c465-11cf-8056-444553540000} (GUID_DEVCLASS_USB)
Service                  : usbccgp
Enumerator               : USB
Location Info            : Port_#0002.Hub_#0001
Address                  : 2
Location IDs             : PCIROOT(0)#PCI(0801)#PCI(0003)#USBROOT(0)#USB(2), ACPI(_SB_)#ACPI(PCI0)#ACPI(GP17)#ACPI(XHC0)#ACPI(RHUB)#ACPI(PRT2)
Container ID             : {63a319dc-cfe2-11f0-8ee7-010101010000}
Manufacturer Info        : (Стандартный USB хост-контроллер)
Capabilities             : 0x84 (Removable, SurpriseRemovalOK)
Status                   : 0x0180400A (DN_DRIVER_LOADED, DN_STARTED, DN_REMOVABLE, DN_NT_ENUMERATOR, DN_NT_DRIVER)
Problem Code             : 0
Address                  : 2
EnhancedPowerMgmtEnabled : 0
Power State              : D0 (supported: D0, D1, D2, D3, wake from D0, wake from D1, wake from D2)

        +++++++++++++++++ Registry USB Flags +++++++++++++++++
HKEY_LOCAL_MACHINE\SYSTEM\CurrentControlSet\Control\usbflags\24AE20130110
 osvc                    : REG_BINARY 00 00

        ---------------- Connection Information ---------------
Connection Index         : 0x02 (Port 2)
Connection Status        : 0x01 (DeviceConnected)
Current Config Value     : 0x01 (Configuration 1)
Device Address           : 0x03 (3)
Is Hub                   : 0x00 (no)
Device Bus Speed         : 0x01 (Full-Speed)
Number of open Pipes     : 0x03 (3 pipes to data endpoints)
Pipe[0]                  : EndpointID=1  Direction=IN   ScheduleOffset=0  Type=Interrupt  wMaxPacketSize=0x40    bInterval=10  -> 718 Bits/ms = 89750 Bytes/s
Pipe[1]                  : EndpointID=2  Direction=IN   ScheduleOffset=0  Type=Interrupt  wMaxPacketSize=0x40    bInterval=10  -> 718 Bits/ms = 89750 Bytes/s
Pipe[2]                  : EndpointID=3  Direction=IN   ScheduleOffset=0  Type=Interrupt  wMaxPacketSize=0x40    bInterval=10  -> 718 Bits/ms = 89750 Bytes/s
Data (HexDump)           : 02 00 00 00 12 01 00 02 00 00 00 40 AE 24 13 20   ...........@.$. 
                           10 01 01 02 00 01 01 01 00 03 00 03 00 00 00 01   ................
                           00 00 00 07 05 81 03 40 00 0A 00 00 00 00 07 05   .......@........
                           82 03 40 00 0A 00 00 00 00 07 05 83 03 40 00 0A   ..@..........@..
                           00 00 00 00                                       ....

        --------------- Connection Information V2 -------------
Connection Index         : 0x02 (2)
Length                   : 0x10 (16 bytes)
SupportedUsbProtocols    : 0x03
 Usb110                  : 1 (yes, port supports USB 1.1)
 Usb200                  : 1 (yes, port supports USB 2.0)
 Usb300                  : 0 (no, port not supports USB 3.0) -> but Companion Port 2-6 does
 ReservedMBZ             : 0x00
Flags                    : 0x00
 DevIsOpAtSsOrHigher     : 0 (Device is not operating at SuperSpeed or higher)
 DevIsSsCapOrHigher      : 0 (Device is not SuperSpeed capable or higher)
 DevIsOpAtSsPlusOrHigher : 0 (Device is not operating at SuperSpeedPlus or higher)
 DevIsSsPlusCapOrHigher  : 0 (Device is not SuperSpeedPlus capable or higher)
 ReservedMBZ             : 0x00
Data (HexDump)           : 02 00 00 00 10 00 00 00 03 00 00 00 00 00 00 00   ................

    ---------------------- Device Descriptor ----------------------
bLength                  : 0x12 (18 bytes)
bDescriptorType          : 0x01 (Device Descriptor)
bcdUSB                   : 0x200 (USB Version 2.0) -> but device is Full-Speed only
bDeviceClass             : 0x00 (defined by the interface descriptors)
bDeviceSubClass          : 0x00
bDeviceProtocol          : 0x00
bMaxPacketSize0          : 0x40 (64 bytes)
idVendor                 : 0x24AE (Shenzhen Rapoo Technology Co., Ltd.)
idProduct                : 0x2013
bcdDevice                : 0x0110
iManufacturer            : 0x01 (String Descriptor 1)
 Language 0x0409         : "RAPOO"
iProduct                 : 0x02 (String Descriptor 2)
 Language 0x0409         : "Rapoo 2.4G Wireless Device"
iSerialNumber            : 0x00 (No String Descriptor)
bNumConfigurations       : 0x01 (1 Configuration)
Data (HexDump)           : 12 01 00 02 00 00 00 40 AE 24 13 20 10 01 01 02   .......@.$. ....
                           00 01                                             ..

    ------------------ Configuration Descriptor -------------------
bLength                  : 0x09 (9 bytes)
bDescriptorType          : 0x02 (Configuration Descriptor)
wTotalLength             : 0x0054 (84 bytes)
bNumInterfaces           : 0x03 (3 Interfaces)
bConfigurationValue      : 0x01 (Configuration 1)
iConfiguration           : 0x00 (No String Descriptor)
bmAttributes             : 0xA0
 D7: Reserved, set 1     : 0x01
 D6: Self Powered        : 0x00 (no)
 D5: Remote Wakeup       : 0x01 (yes)
 D4..0: Reserved, set 0  : 0x00
MaxPower                 : 0x32 (100 mA)
Data (HexDump)           : 09 02 54 00 03 01 00 A0 32 09 04 00 00 01 03 01   ..T.....2.......
                           02 00 09 21 10 01 00 01 22 40 00 07 05 81 03 40   ...!...."@.....@
                           00 0A 09 04 01 00 01 03 01 01 00 09 21 10 01 00   ............!...
                           01 22 5E 00 07 05 82 03 40 00 0A 09 04 02 00 01   ."^.....@.......
                           03 01 01 00 09 21 10 01 00 01 22 40 00 07 05 83   .....!...."@....
                           03 40 00 0A                                       .@..

        ---------------- Interface Descriptor -----------------
bLength                  : 0x09 (9 bytes)
bDescriptorType          : 0x04 (Interface Descriptor)
bInterfaceNumber         : 0x00 (Interface 0)
bAlternateSetting        : 0x00
bNumEndpoints            : 0x01 (1 Endpoint)
bInterfaceClass          : 0x03 (HID - Human Interface Device)
bInterfaceSubClass       : 0x01 (Boot Interface)
bInterfaceProtocol       : 0x02 (Mouse)
iInterface               : 0x00 (No String Descriptor)
Data (HexDump)           : 09 04 00 00 01 03 01 02 00                        .........

        ------------------- HID Descriptor --------------------
bLength                  : 0x09 (9 bytes)
bDescriptorType          : 0x21 (HID Descriptor)
bcdHID                   : 0x0110 (HID Version 1.10)
bCountryCode             : 0x00 (00 = not localized)
bNumDescriptors          : 0x01
Data (HexDump)           : 09 21 10 01 00 01 22 40 00                        .!...."@.
Descriptor 1:
bDescriptorType          : 0x22 (Class=Report)
wDescriptorLength        : 0x0040 (64 bytes)
  05 01             Usage Page (Generic Desktop Controls)
  09 02             Usage (Mouse)
  A1 01             Collection (Application)
  09 01               Usage (Pointer)
  A1 00               Collection (Physical)
  05 09                 Usage Page (Buttons)
  19 01                 Usage Minimum (1)
  29 05                 Usage Maximum (5)
  15 00                 Logical Minimum (0)
  25 01                 Logical Maximum (1)
  95 05                 Report Count (5)
  75 01                 Report Size (1)
  81 02                 Input (Var)
  95 01                 Report Count (1)
  75 03                 Report Size (3)
  81 03                 Input (Const, Var)
  05 01                 Usage Page (Generic Desktop Controls)
  09 30                 Usage (Direction-X)
  09 31                 Usage (Direction-Y)
  16 01 80              Logical Minimum (-32767)
  26 FF 7F              Logical Maximum (32767)
  75 10                 Report Size (16)
  95 02                 Report Count (2)
  81 06                 Input (Var, Rel)
  09 38                 Usage (Wheel)
  15 81                 Logical Minimum (-127)
  25 7F                 Logical Maximum (127)
  75 08                 Report Size (8)
  95 01                 Report Count (1)
  81 06                 Input (Var, Rel)
  C0                  End Collection
  C0                End Collection
Data (HexDump)           : 05 01 09 02 A1 01 09 01 A1 00 05 09 19 01 29 05   ..............).
                           15 00 25 01 95 05 75 01 81 02 95 01 75 03 81 03   ..%...u.....u...
                           05 01 09 30 09 31 16 01 80 26 FF 7F 75 10 95 02   ...0.1...&..u...
                           81 06 09 38 15 81 25 7F 75 08 95 01 81 06 C0 C0   ...8..%.u.......

        ----------------- Endpoint Descriptor -----------------
bLength                  : 0x07 (7 bytes)
bDescriptorType          : 0x05 (Endpoint Descriptor)
bEndpointAddress         : 0x81 (Direction=IN EndpointID=1)
bmAttributes             : 0x03 (TransferType=Interrupt)
wMaxPacketSize           : 0x0040 (64 bytes)
bInterval                : 0x0A (10 ms)
Data (HexDump)           : 07 05 81 03 40 00 0A                              ....@..

        ---------------- Interface Descriptor -----------------
bLength                  : 0x09 (9 bytes)
bDescriptorType          : 0x04 (Interface Descriptor)
bInterfaceNumber         : 0x01 (Interface 1)
bAlternateSetting        : 0x00
bNumEndpoints            : 0x01 (1 Endpoint)
bInterfaceClass          : 0x03 (HID - Human Interface Device)
bInterfaceSubClass       : 0x01 (Boot Interface)
bInterfaceProtocol       : 0x01 (Keyboard)
iInterface               : 0x00 (No String Descriptor)
Data (HexDump)           : 09 04 01 00 01 03 01 01 00                        .........

        ------------------- HID Descriptor --------------------
bLength                  : 0x09 (9 bytes)
bDescriptorType          : 0x21 (HID Descriptor)
bcdHID                   : 0x0110 (HID Version 1.10)
bCountryCode             : 0x00 (00 = not localized)
bNumDescriptors          : 0x01
Data (HexDump)           : 09 21 10 01 00 01 22 5E 00                        .!...."^.
Descriptor 1:
bDescriptorType          : 0x22 (Class=Report)
wDescriptorLength        : 0x005E (94 bytes)
  06 00 FF          Usage Page (Vendor Defined)
  09 0E             Usage (unk)
  A1 01             Collection (Application)
  85 BA               Report ID (0xBA)
  95 1F               Report Count (31)
  75 08               Report Size (8)
  26 FF 00            Logical Maximum (255)
  15 00               Logical Minimum (0)
  09 01               Usage (unk)
  91 02               Output (Var)
  85 BA               Report ID (0xBA)
  95 1F               Report Count (31)
  75 08               Report Size (8)
  26 FF 00            Logical Maximum (255)
  15 00               Logical Minimum (0)
  09 01               Usage (unk)
  81 02               Input (Var)
  C0                End Collection
  05 01             Usage Page (Generic Desktop Controls)
  09 80             Usage (System Control)
  A1 01             Collection (Application)
  85 02               Report ID (0x02)
  05 01               Usage Page (Generic Desktop Controls)
  19 81               Usage Minimum (-127)
  29 83               Usage Maximum (-125)
  15 00               Logical Minimum (0)
  25 01               Logical Maximum (1)
  95 03               Report Count (3)
  75 01               Report Size (1)
  81 06               Input (Var, Rel)
  95 01               Report Count (1)
  75 05               Report Size (5)
  81 01               Input (Const)
  C0                End Collection
  05 0C             Usage Page (Consumer)
  09 01             Usage (Consumer Control)
  A1 01             Collection (Application)
  85 03               Report ID (0x03)
  15 00               Logical Minimum (0)
  26 80 03            Logical Maximum (896)
  19 00               Usage Minimum (0)
  2A 80 03            Usage Maximum (896)
  75 10               Report Size (16)
  95 01               Report Count (1)
  81 00               Input ()
  C0                End Collection
Data (HexDump)           : 06 00 FF 09 0E A1 01 85 BA 95 1F 75 08 26 FF 00   ...........u.&..
                           15 00 09 01 91 02 85 BA 95 1F 75 08 26 FF 00 15   ..........u.&...
                           00 09 01 81 02 C0 05 01 09 80 A1 01 85 02 05 01   ................
                           19 81 29 83 15 00 25 01 95 03 75 01 81 06 95 01   ..)...%...u.....
                           75 05 81 01 C0 05 0C 09 01 A1 01 85 03 15 00 26   u..............&
                           80 03 19 00 2A 80 03 75 10 95 01 81 00 C0         ....*..u......

        ----------------- Endpoint Descriptor -----------------
bLength                  : 0x07 (7 bytes)
bDescriptorType          : 0x05 (Endpoint Descriptor)
bEndpointAddress         : 0x82 (Direction=IN EndpointID=2)
bmAttributes             : 0x03 (TransferType=Interrupt)
wMaxPacketSize           : 0x0040 (64 bytes)
bInterval                : 0x0A (10 ms)
Data (HexDump)           : 07 05 82 03 40 00 0A                              ....@..

        ---------------- Interface Descriptor -----------------
bLength                  : 0x09 (9 bytes)
bDescriptorType          : 0x04 (Interface Descriptor)
bInterfaceNumber         : 0x02 (Interface 2)
bAlternateSetting        : 0x00
bNumEndpoints            : 0x01 (1 Endpoint)
bInterfaceClass          : 0x03 (HID - Human Interface Device)
bInterfaceSubClass       : 0x01 (Boot Interface)
bInterfaceProtocol       : 0x01 (Keyboard)
iInterface               : 0x00 (No String Descriptor)
Data (HexDump)           : 09 04 02 00 01 03 01 01 00                        .........

        ------------------- HID Descriptor --------------------
bLength                  : 0x09 (9 bytes)
bDescriptorType          : 0x21 (HID Descriptor)
bcdHID                   : 0x0110 (HID Version 1.10)
bCountryCode             : 0x00 (00 = not localized)
bNumDescriptors          : 0x01
Data (HexDump)           : 09 21 10 01 00 01 22 40 00                        .!...."@.
Descriptor 1:
bDescriptorType          : 0x22 (Class=Report)
wDescriptorLength        : 0x0040 (64 bytes)
  05 01             Usage Page (Generic Desktop Controls)
  09 06             Usage (Keyboard)
  A1 01             Collection (Application)
  05 07               Usage Page (Keyboard)
  19 E0               Usage Minimum (-32)
  29 E7               Usage Maximum (-25)
  15 00               Logical Minimum (0)
  25 01               Logical Maximum (1)
  75 01               Report Size (1)
  95 08               Report Count (8)
  81 02               Input (Var)
  95 01               Report Count (1)
  75 08               Report Size (8)
  81 03               Input (Const, Var)
  95 05               Report Count (5)
  75 01               Report Size (1)
  05 08               Usage Page (LEDs)
  19 01               Usage Minimum (1)
  29 05               Usage Maximum (5)
  91 02               Output (Var)
  95 01               Report Count (1)
  75 03               Report Size (3)
  91 03               Output (Const, Var)
  95 06               Report Count (6)
  75 08               Report Size (8)
  15 00               Logical Minimum (0)
  26 FF 00            Logical Maximum (255)
  05 07               Usage Page (Keyboard)
  19 00               Usage Minimum (0)
  29 FF               Usage Maximum (-1)
  81 00               Input ()
  C0                End Collection
Data (HexDump)           : 05 01 09 06 A1 01 05 07 19 E0 29 E7 15 00 25 01   ..........)...%.
                           75 01 95 08 81 02 95 01 75 08 81 03 95 05 75 01   u.......u.....u.
                           05 08 19 01 29 05 91 02 95 01 75 03 91 03 95 06   ....).....u.....
                           75 08 15 00 26 FF 00 05 07 19 00 29 FF 81 00 C0   u...&......)....

        ----------------- Endpoint Descriptor -----------------
bLength                  : 0x07 (7 bytes)
bDescriptorType          : 0x05 (Endpoint Descriptor)
bEndpointAddress         : 0x83 (Direction=IN EndpointID=3)
bmAttributes             : 0x03 (TransferType=Interrupt)
wMaxPacketSize           : 0x0040 (64 bytes)
bInterval                : 0x0A (10 ms)
Data (HexDump)           : 07 05 83 03 40 00 0A                              ....@..

    ----------------- Device Qualifier Descriptor -----------------
Error                    : ERROR_GEN_FAILURE  (because the device is Full-Speed only)

      -------------------- String Descriptors -------------------
             ------ String Descriptor 0 ------
bLength                  : 0x04 (4 bytes)
bDescriptorType          : 0x03 (String Descriptor)
Language ID[0]           : 0x0409 (English - United States)
Data (HexDump)           : 04 03 09 04                                       ....
             ------ String Descriptor 1 ------
bLength                  : 0x0C (12 bytes)
bDescriptorType          : 0x03 (String Descriptor)
Language 0x0409          : "RAPOO"
Data (HexDump)           : 0C 03 52 00 41 00 50 00 4F 00 4F 00               ..R.A.P.O.O.
             ------ String Descriptor 2 ------
bLength                  : 0x36 (54 bytes)
bDescriptorType          : 0x03 (String Descriptor)
Language 0x0409          : "Rapoo 2.4G Wireless Device"
Data (HexDump)           : 36 03 52 00 61 00 70 00 6F 00 6F 00 20 00 32 00   6.R.a.p.o.o. .2.
                           2E 00 34 00 47 00 20 00 57 00 69 00 72 00 65 00   ..4.G. .W.i.r.e.
                           6C 00 65 00 73 00 73 00 20 00 44 00 65 00 76 00   l.e.s.s. .D.e.v.
                           69 00 63 00 65 00                                 i.c.e.

        +++++++++++++++++ Device Information ++++++++++++++++++
Device Description       : USB-устройство ввода
Device Path              : \\?\USB#VID_24AE&PID_2013&MI_00#7&4f66612&0&0000#{a6782bce-4376-4de2-8096-70aa9e8fed19}
Kernel Name              : \Device\0000103a
Device ID                : USB\VID_24AE&PID_2013&MI_00\7&4F66612&0&0000
Hardware IDs             : USB\VID_24AE&PID_2013&REV_0110&MI_00 USB\VID_24AE&PID_2013&MI_00
Driver KeyName           : {745a17a0-74d3-11d0-b6fe-00a0c90f57da}\0086 (GUID_DEVCLASS_HIDCLASS)
Driver                   : \SystemRoot\System32\drivers\hidusb.sys (Version: 10.0.26100.7262  Date: 2025-11-18  Company: Microsoft Corporation)
Driver Inf               : C:\WINDOWS\inf\input.inf
Legacy BusType           : PNPBus
Class                    : HIDClass
Class GUID               : {745a17a0-74d3-11d0-b6fe-00a0c90f57da} (GUID_DEVCLASS_HIDCLASS)
Service                  : HidUsb
Enumerator               : USB
Location Info            : 0004.0000.0003.002.000.000.000.000.000
Address                  : 2
Manufacturer Info        : (Стандартные системные устройства)
Capabilities             : 0x80 (SurpriseRemovalOK)
Status                   : 0x0180200A (DN_DRIVER_LOADED, DN_STARTED, DN_DISABLEABLE, DN_NT_ENUMERATOR, DN_NT_DRIVER)
Problem Code             : 0
SelectiveSuspendEnabled  : 0
EnhancedPowerMgmtEnabled : 1
Power State              : D0 (supported: D0, D1, D2, D3, wake from D0, wake from D1, wake from D2)

        +++++++++++++++++ Device Information ++++++++++++++++++
Device Description       : HID-совместимая мышь
Device Path 1            : \\?\HID#VID_24AE&PID_2013&MI_00#8&268b5692&0&0000#{4d1e55b2-f16f-11cf-88cb-001111000030} (GUID_DEVINTERFACE_HID)
Device Path 2            : \\?\HID#VID_24AE&PID_2013&MI_00#8&268b5692&0&0000#{378de44c-56ef-11d1-bc8c-00a0c91405dd} (GUID_DEVINTERFACE_MOUSE)
Kernel Name              : \Device\0000103d
Device ID                : HID\VID_24AE&PID_2013&MI_00\8&268B5692&0&0000
Hardware IDs             : HID\VID_24AE&PID_2013&REV_0110&MI_00 HID\VID_24AE&PID_2013&MI_00 HID\VID_24AE&UP:0001_U:0002 HID_DEVICE_SYSTEM_MOUSE HID_DEVICE_UP:0001_U:0002 HID_DEVICE
Driver KeyName           : {4d36e96f-e325-11ce-bfc1-08002be10318}\0025 (GUID_DEVCLASS_MOUSE)
Driver                   : \SystemRoot\System32\drivers\mouhid.sys (Version: 10.0.26100.1150  Date: 2025-11-06  Company: Microsoft Corporation)
Driver Inf               : C:\WINDOWS\inf\msmouse.inf
Legacy BusType           : PNPBus
Class                    : Mouse
Class GUID               : {4d36e96f-e325-11ce-bfc1-08002be10318} (GUID_DEVCLASS_MOUSE)
Service                  : mouhid
Enumerator               : HID
Location Info            : -
Address                  : 1
Manufacturer Info        : Microsoft
Capabilities             : 0xA0 (SilentInstall, SurpriseRemovalOK)
Status                   : 0x0180200A (DN_DRIVER_LOADED, DN_STARTED, DN_DISABLEABLE, DN_NT_ENUMERATOR, DN_NT_DRIVER)
Problem Code             : 0
EnhancedPowerMgmtEnabled : 0
Power State              : D0 (supported: D0, D1, D2, D3, wake from D0, wake from D1, wake from D2)

             +++++++++++++ Mouse Information ++++++++++++++
Input Data Queue Length  : 2
Mouse Identifier         : 256
Number of Buttons        : 5
Sample Rate              : 0

             ++++++++++++++ HID Information +++++++++++++++
Manufacturer             : RAPOO
Product                  : Rapoo 2.4G Wireless Device
UsagePage                : 0x01 (Generic Desktop Controls)
Usage                    : 0x02 (Mouse)

        +++++++++++++++++ Device Information ++++++++++++++++++
Device Description       : USB-устройство ввода
Device Path              : \\?\USB#VID_24AE&PID_2013&MI_01#7&4f66612&0&0001#{a6782bce-4376-4de2-8096-70aa9e8fed19}
Kernel Name              : \Device\0000103b
Device ID                : USB\VID_24AE&PID_2013&MI_01\7&4F66612&0&0001
Hardware IDs             : USB\VID_24AE&PID_2013&REV_0110&MI_01 USB\VID_24AE&PID_2013&MI_01
Driver KeyName           : {745a17a0-74d3-11d0-b6fe-00a0c90f57da}\0087 (GUID_DEVCLASS_HIDCLASS)
Driver                   : \SystemRoot\System32\drivers\hidusb.sys (Version: 10.0.26100.7262  Date: 2025-11-18  Company: Microsoft Corporation)
Driver Inf               : C:\WINDOWS\inf\input.inf
Legacy BusType           : PNPBus
Class                    : HIDClass
Class GUID               : {745a17a0-74d3-11d0-b6fe-00a0c90f57da} (GUID_DEVCLASS_HIDCLASS)
Service                  : HidUsb
Enumerator               : USB
Location Info            : 0004.0000.0003.002.000.000.000.000.000
Address                  : 3
Manufacturer Info        : (Стандартные системные устройства)
Capabilities             : 0x80 (SurpriseRemovalOK)
Status                   : 0x0180200A (DN_DRIVER_LOADED, DN_STARTED, DN_DISABLEABLE, DN_NT_ENUMERATOR, DN_NT_DRIVER)
Problem Code             : 0
SelectiveSuspendEnabled  : 0
EnhancedPowerMgmtEnabled : 1
Power State              : D0 (supported: D0, D1, D2, D3, wake from D0, wake from D1, wake from D2)

        +++++++++++++++++ Device Information ++++++++++++++++++
Device Description       : HID-совместимое устройство, определенное поставщиком
Device Path              : \\?\HID#VID_24AE&PID_2013&MI_01&Col01#8&135b3a54&0&0000#{4d1e55b2-f16f-11cf-88cb-001111000030} (GUID_DEVINTERFACE_HID)
Kernel Name              : \Device\0000103e
Device ID                : HID\VID_24AE&PID_2013&MI_01&COL01\8&135B3A54&0&0000
Hardware IDs             : HID\VID_24AE&PID_2013&REV_0110&MI_01&Col01 HID\VID_24AE&PID_2013&MI_01&Col01 HID\VID_24AE&UP:FF00_U:000E HID_DEVICE_UP:FF00_U:000E HID_DEVICE_UPR:FF00-FFFF HID_DEVICE
Driver KeyName           : {745a17a0-74d3-11d0-b6fe-00a0c90f57da}\0089 (GUID_DEVCLASS_HIDCLASS)
Driver Inf               : C:\WINDOWS\inf\input.inf
Legacy BusType           : PNPBus
Class                    : HIDClass
Class GUID               : {745a17a0-74d3-11d0-b6fe-00a0c90f57da} (GUID_DEVCLASS_HIDCLASS)
Enumerator               : HID
Location Info            : -
Address                  : 1
Manufacturer Info        : (Стандартные системные устройства)
Capabilities             : 0xE0 (SilentInstall, RawDeviceOK, SurpriseRemovalOK)
Status                   : 0x0180200A (DN_DRIVER_LOADED, DN_STARTED, DN_DISABLEABLE, DN_NT_ENUMERATOR, DN_NT_DRIVER)
Problem Code             : 0
EnhancedPowerMgmtEnabled : 0
Power State              : D0 (supported: D0, D1, D2, D3, wake from D0, wake from D1, wake from D2)

             ++++++++++++++ HID Information +++++++++++++++
Manufacturer             : RAPOO
Product                  : Rapoo 2.4G Wireless Device
UsagePage                : 0xFF00 (Vendor Defined)
Usage                    : 0x0E (unk)

        +++++++++++++++++ Device Information ++++++++++++++++++
Device Description       : HID-совместимый системный контроллер
Device Path 1            : \\?\HID#VID_24AE&PID_2013&MI_01&Col02#8&135b3a54&0&0001#{4afa3d53-74a7-11d0-be5e-00a0c9062857} (GUID_DEVICE_SYS_BUTTON)
Device Path 2            : \\?\HID#VID_24AE&PID_2013&MI_01&Col02#8&135b3a54&0&0001#{4d1e55b2-f16f-11cf-88cb-001111000030} (GUID_DEVINTERFACE_HID)
Kernel Name              : \Device\0000103f
Device ID                : HID\VID_24AE&PID_2013&MI_01&COL02\8&135B3A54&0&0001
Hardware IDs             : HID\VID_24AE&PID_2013&REV_0110&MI_01&Col02 HID\VID_24AE&PID_2013&MI_01&Col02 HID\VID_24AE&UP:0001_U:0080 HID_DEVICE_SYSTEM_CONTROL HID_DEVICE_UP:0001_U:0080 HID_DEVICE
Driver KeyName           : {745a17a0-74d3-11d0-b6fe-00a0c90f57da}\0090 (GUID_DEVCLASS_HIDCLASS)
Driver Inf               : C:\WINDOWS\inf\input.inf
Legacy BusType           : PNPBus
Class                    : HIDClass
Class GUID               : {745a17a0-74d3-11d0-b6fe-00a0c90f57da} (GUID_DEVCLASS_HIDCLASS)
Enumerator               : HID
Location Info            : -
Address                  : 2
Manufacturer Info        : (Стандартные системные устройства)
Capabilities             : 0xE0 (SilentInstall, RawDeviceOK, SurpriseRemovalOK)
Status                   : 0x0180200A (DN_DRIVER_LOADED, DN_STARTED, DN_DISABLEABLE, DN_NT_ENUMERATOR, DN_NT_DRIVER)
Problem Code             : 0
EnhancedPowerMgmtEnabled : 0
Power State              : D0 (supported: D0, D1, D2, D3, wake from D0, wake from D1, wake from D2)

             ++++++++++++++ HID Information +++++++++++++++
Manufacturer             : RAPOO
Product                  : Rapoo 2.4G Wireless Device
UsagePage                : 0x01 (Generic Desktop Controls)
Usage                    : 0x80 (System Control)

        +++++++++++++++++ Device Information ++++++++++++++++++
Device Description       : HID-совместимое устройство управления
Device Path              : \\?\HID#VID_24AE&PID_2013&MI_01&Col03#8&135b3a54&0&0002#{4d1e55b2-f16f-11cf-88cb-001111000030} (GUID_DEVINTERFACE_HID)
Kernel Name              : \Device\00001040
Device ID                : HID\VID_24AE&PID_2013&MI_01&COL03\8&135B3A54&0&0002
Hardware IDs             : HID\VID_24AE&PID_2013&REV_0110&MI_01&Col03 HID\VID_24AE&PID_2013&MI_01&Col03 HID\VID_24AE&UP:000C_U:0001 HID_DEVICE_SYSTEM_CONSUMER HID_DEVICE_UP:000C_U:0001 HID_DEVICE
Driver KeyName           : {745a17a0-74d3-11d0-b6fe-00a0c90f57da}\0091 (GUID_DEVCLASS_HIDCLASS)
Driver Inf               : C:\WINDOWS\inf\hidserv.inf
Legacy BusType           : PNPBus
Class                    : HIDClass
Class GUID               : {745a17a0-74d3-11d0-b6fe-00a0c90f57da} (GUID_DEVCLASS_HIDCLASS)
Enumerator               : HID
Location Info            : -
Address                  : 3
Manufacturer Info        : Microsoft
Capabilities             : 0xE0 (SilentInstall, RawDeviceOK, SurpriseRemovalOK)
Status                   : 0x0180200A (DN_DRIVER_LOADED, DN_STARTED, DN_DISABLEABLE, DN_NT_ENUMERATOR, DN_NT_DRIVER)
Problem Code             : 0
EnhancedPowerMgmtEnabled : 0
Power State              : D0 (supported: D0, D1, D2, D3, wake from D0, wake from D1, wake from D2)

             ++++++++++++++ HID Information +++++++++++++++
Manufacturer             : RAPOO
Product                  : Rapoo 2.4G Wireless Device
UsagePage                : 0x0C (Consumer)
Usage                    : 0x01 (Consumer Control)

        +++++++++++++++++ Device Information ++++++++++++++++++
Device Description       : USB-устройство ввода
Device Path              : \\?\USB#VID_24AE&PID_2013&MI_02#7&4f66612&0&0002#{a6782bce-4376-4de2-8096-70aa9e8fed19}
Kernel Name              : \Device\0000103c
Device ID                : USB\VID_24AE&PID_2013&MI_02\7&4F66612&0&0002
Hardware IDs             : USB\VID_24AE&PID_2013&REV_0110&MI_02 USB\VID_24AE&PID_2013&MI_02
Driver KeyName           : {745a17a0-74d3-11d0-b6fe-00a0c90f57da}\0088 (GUID_DEVCLASS_HIDCLASS)
Driver                   : \SystemRoot\System32\drivers\hidusb.sys (Version: 10.0.26100.7262  Date: 2025-11-18  Company: Microsoft Corporation)
Driver Inf               : C:\WINDOWS\inf\input.inf
Legacy BusType           : PNPBus
Class                    : HIDClass
Class GUID               : {745a17a0-74d3-11d0-b6fe-00a0c90f57da} (GUID_DEVCLASS_HIDCLASS)
Service                  : HidUsb
Enumerator               : USB
Location Info            : 0004.0000.0003.002.000.000.000.000.000
Address                  : 4
Manufacturer Info        : (Стандартные системные устройства)
Capabilities             : 0x80 (SurpriseRemovalOK)
Status                   : 0x0180000A (DN_DRIVER_LOADED, DN_STARTED, DN_NT_ENUMERATOR, DN_NT_DRIVER)
Problem Code             : 0
SelectiveSuspendEnabled  : 0
EnhancedPowerMgmtEnabled : 1
Power State              : D0 (supported: D0, D1, D2, D3, wake from D0, wake from D1, wake from D2)

        +++++++++++++++++ Device Information ++++++++++++++++++
Device Description       : Клавиатура HID
Device Path 1            : \\?\HID#VID_24AE&PID_2013&MI_02#8&2b1e16&0&0000#{884b96c3-56ef-11d1-bc8c-00a0c91405dd} (GUID_DEVINTERFACE_KEYBOARD)
Device Path 2            : \\?\HID#VID_24AE&PID_2013&MI_02#8&2b1e16&0&0000#{4d1e55b2-f16f-11cf-88cb-001111000030}\kbd (GUID_DEVINTERFACE_HID)
Kernel Name              : \Device\00001041
Device ID                : HID\VID_24AE&PID_2013&MI_02\8&2B1E16&0&0000
Hardware IDs             : HID\VID_24AE&PID_2013&REV_0110&MI_02 HID\VID_24AE&PID_2013&MI_02 HID\VID_24AE&UP:0001_U:0006 HID_DEVICE_SYSTEM_KEYBOARD HID_DEVICE_UP:0001_U:0006 HID_DEVICE
Driver KeyName           : {4d36e96b-e325-11ce-bfc1-08002be10318}\0018 (GUID_DEVCLASS_KEYBOARD)
Driver                   : \SystemRoot\System32\drivers\kbdhid.sys (Version: 10.0.26100.1930  Date: 2025-11-06  Company: Microsoft Corporation)
Driver Inf               : C:\WINDOWS\inf\keyboard.inf
Legacy BusType           : PNPBus
Class                    : Keyboard
Class GUID               : {4d36e96b-e325-11ce-bfc1-08002be10318} (GUID_DEVCLASS_KEYBOARD)
Service                  : kbdhid
Enumerator               : HID
Location Info            : -
Address                  : 1
Manufacturer Info        : (Стандартные клавиатуры)
Capabilities             : 0xA0 (SilentInstall, SurpriseRemovalOK)
Status                   : 0x0180000A (DN_DRIVER_LOADED, DN_STARTED, DN_NT_ENUMERATOR, DN_NT_DRIVER)
Problem Code             : 0
EnhancedPowerMgmtEnabled : 0
Power State              : D0 (supported: D0, D1, D2, D3, wake from D0, wake from D1, wake from D2)

             ++++++++++++ Keyboad Information +++++++++++++
Keyboard ID.Type         : 0x51 (HID)
Keyboard ID.Subtype      : 0
Keyboard Mode            : 1
Number of Function Keys  : 12
Number of Indicators     : 3
Number of Keys Total     : 264
Input Data Queue Length  : 1
Key Repeat Minimum.UnitId: 145
Key Repeat Minimum.Rate  : 2 per second
Key Repeat Minimum.Delay : 250 ms
Key Repeat Maximum.UnitId: 145
Key Repeat Maximum.Rate  : 30 per second
Key Repeat Maximum.Delay : 1000 ms
Key Repeat UnitId        : 0
Key Repeat Rate          : 30 per second
Key Repeat Delay         : 500 ms

             ++++++++++++++ HID Information +++++++++++++++
Manufacturer             : RAPOO
Product                  : Rapoo 2.4G Wireless Device
UsagePage                : 0x01 (Generic Desktop Controls)
Usage                    : 0x06 (Keyboard)
