
    =========================== USB Port2 ===========================

Connection Status        : 0x01 (Device is connected)
Port Chain               : 2-2
Properties               : 0x01
 IsUserConnectable       : yes
 PortIsDebugCapable      : no
 PortHasMultiCompanions  : no
 PortConnectorIsTypeC    : no
ConnectionIndex          : 0x02 (Port 2)
CompanionIndex           : 0
 CompanionHubSymLnk      : USB#ROOT_HUB30#5&315b279c&0&0#{f18a0e88-c30c-11d0-8815-00a0c906bed8}
 CompanionPortNumber     : 0x06 (Port 6)
 -> CompanionPortChain   : 2-6

      ========================== Summary =========================
Vendor ID                : 0x0000
Product ID               : 0x3825
Manufacturer String      : ---
Product String           : " USB OPTICAL MOUSE"
Serial                   : ---
USB Version              : 1.1 (1.5 Mbit/s LowSpeed)
Port maximum Speed       : High-Speed (Companion Port 2-6 is doing the SuperSpeed)
Device maximum Speed     : Low-Speed
Device Connection Speed  : Low-Speed
Self powered             : no
Demanded Current         : 100 mA
Used Endpoints           : 2

      ======================== USB Device ========================

        +++++++++++++++++ Device Information ++++++++++++++++++
Device Description       : USB-устройство ввода
Device Path 1            : \\?\USB#VID_0000&PID_3825#6&5280d8e&0&2#{a5dcbf10-6530-11d2-901f-00c04fb951ed} (GUID_DEVINTERFACE_USB_DEVICE)
Device Path 2            : \\?\USB#VID_0000&PID_3825#6&5280d8e&0&2#{a6782bce-4376-4de2-8096-70aa9e8fed19}
Kernel Name              : \Device\USBPDO-70
Device ID                : USB\VID_0000&PID_3825\6&5280D8E&0&2
Hardware IDs             : USB\VID_0000&PID_3825&REV_0100 USB\VID_0000&PID_3825
Driver KeyName           : {745a17a0-74d3-11d0-b6fe-00a0c90f57da}\0081 (GUID_DEVCLASS_HIDCLASS)
Driver                   : \SystemRoot\System32\drivers\hidusb.sys (Version: 10.0.26100.7262  Date: 2025-11-18  Company: Microsoft Corporation)
Driver Inf               : C:\WINDOWS\inf\input.inf
Legacy BusType           : PNPBus
Class                    : HIDClass
Class GUID               : {745a17a0-74d3-11d0-b6fe-00a0c90f57da} (GUID_DEVCLASS_HIDCLASS)
Service                  : HidUsb
Enumerator               : USB
Location Info            : Port_#0002.Hub_#0001
Address                  : 2
Location IDs             : PCIROOT(0)#PCI(0801)#PCI(0003)#USBROOT(0)#USB(2), ACPI(_SB_)#ACPI(PCI0)#ACPI(GP17)#ACPI(XHC0)#ACPI(RHUB)#ACPI(PRT2)
Container ID             : {f0890d00-cfd3-11f0-8ee7-010101010000}
Manufacturer Info        : (Стандартные системные устройства)
Capabilities             : 0x84 (Removable, SurpriseRemovalOK)
Status                   : 0x0180600A (DN_DRIVER_LOADED, DN_STARTED, DN_DISABLEABLE, DN_REMOVABLE, DN_NT_ENUMERATOR, DN_NT_DRIVER)
Problem Code             : 0
SelectiveSuspendEnabled  : 0
EnhancedPowerMgmtEnabled : 1
Power State              : D0 (supported: D0, D1, D2, D3, wake from D0, wake from D1, wake from D2)

        ---------------- Connection Information ---------------
Connection Index         : 0x02 (Port 2)
Connection Status        : 0x01 (DeviceConnected)
Current Config Value     : 0x01 (Configuration 1)
Device Address           : 0x05 (5)
Is Hub                   : 0x00 (no)
Device Bus Speed         : 0x00 (Low-Speed)
Number of open Pipes     : 0x01 (1 pipe to data endpoints)
Pipe[0]                  : EndpointID=1  Direction=IN   ScheduleOffset=0  Type=Interrupt  wMaxPacketSize=0x6     bInterval=10  -> 177 Bits/ms = 22125 Bytes/s
Data (HexDump)           : 02 00 00 00 12 01 10 01 00 00 00 08 00 00 25 38   ..............%8
                           00 01 00 01 00 01 01 00 00 05 00 01 00 00 00 01   ................
                           00 00 00 07 05 81 03 06 00 0A 00 00 00 00         ..............

        --------------- Connection Information V2 -------------
Connection Index         : 0x02 (2)
Length                   : 0x10 (16 bytes)
SupportedUsbProtocols    : 0x03
 Usb110                  : 1 (yes, port supports USB 1.1)
 Usb200                  : 1 (yes, port supports USB 2.0)
 Usb300                  : 0 (no, port not supports USB 3.0) -> but Companion Port 2-6 does
 ReservedMBZ             : 0x00
Flags                    : 0x00
 DevIsOpAtSsOrHigher     : 0 (Device is not operating at SuperSpeed or higher)
 DevIsSsCapOrHigher      : 0 (Device is not SuperSpeed capable or higher)
 DevIsOpAtSsPlusOrHigher : 0 (Device is not operating at SuperSpeedPlus or higher)
 DevIsSsPlusCapOrHigher  : 0 (Device is not SuperSpeedPlus capable or higher)
 ReservedMBZ             : 0x00
Data (HexDump)           : 02 00 00 00 10 00 00 00 03 00 00 00 00 00 00 00   ................

    ---------------------- Device Descriptor ----------------------
bLength                  : 0x12 (18 bytes)
bDescriptorType          : 0x01 (Device Descriptor)
bcdUSB                   : 0x110 (USB Version 1.1)
bDeviceClass             : 0x00 (defined by the interface descriptors)
bDeviceSubClass          : 0x00
bDeviceProtocol          : 0x00
bMaxPacketSize0          : 0x08 (8 bytes)
idVendor                 : 0x0000
idProduct                : 0x3825
bcdDevice                : 0x0100
iManufacturer            : 0x00 (No String Descriptor)
iProduct                 : 0x01 (String Descriptor 1)
 Language 0x0409         : " USB OPTICAL MOUSE"
iSerialNumber            : 0x00 (No String Descriptor)
bNumConfigurations       : 0x01 (1 Configuration)
Data (HexDump)           : 12 01 10 01 00 00 00 08 00 00 25 38 00 01 00 01   ..........%8....
                           00 01                                             ..

    ------------------ Configuration Descriptor -------------------
bLength                  : 0x09 (9 bytes)
bDescriptorType          : 0x02 (Configuration Descriptor)
wTotalLength             : 0x0022 (34 bytes)
bNumInterfaces           : 0x01 (1 Interface)
bConfigurationValue      : 0x01 (Configuration 1)
iConfiguration           : 0x00 (No String Descriptor)
bmAttributes             : 0xA0
 D7: Reserved, set 1     : 0x01
 D6: Self Powered        : 0x00 (no)
 D5: Remote Wakeup       : 0x01 (yes)
 D4..0: Reserved, set 0  : 0x00
MaxPower                 : 0x32 (100 mA)
Data (HexDump)           : 09 02 22 00 01 01 00 A0 32 09 04 00 00 01 03 01   ..".....2.......
                           02 00 09 21 11 01 00 01 22 42 00 07 05 81 03 06   ...!...."B......
                           00 0A                                             ..

        ---------------- Interface Descriptor -----------------
bLength                  : 0x09 (9 bytes)
bDescriptorType          : 0x04 (Interface Descriptor)
bInterfaceNumber         : 0x00 (Interface 0)
bAlternateSetting        : 0x00
bNumEndpoints            : 0x01 (1 Endpoint)
bInterfaceClass          : 0x03 (HID - Human Interface Device)
bInterfaceSubClass       : 0x01 (Boot Interface)
bInterfaceProtocol       : 0x02 (Mouse)
iInterface               : 0x00 (No String Descriptor)
Data (HexDump)           : 09 04 00 00 01 03 01 02 00                        .........

        ------------------- HID Descriptor --------------------
bLength                  : 0x09 (9 bytes)
bDescriptorType          : 0x21 (HID Descriptor)
bcdHID                   : 0x0111 (HID Version 1.11)
bCountryCode             : 0x00 (00 = not localized)
bNumDescriptors          : 0x01
Data (HexDump)           : 09 21 11 01 00 01 22 42 00                        .!...."B.
Descriptor 1:
bDescriptorType          : 0x22 (Class=Report)
wDescriptorLength        : 0x0042 (66 bytes)
  12 01 10          unk
  01 00             unk
  00                unk
  00                unk
  08                Usage (unk)
  00                unk
  00                unk
  25 38             Logical Maximum (56)
  00                unk
  01 00             unk
  01 00             unk
  01 09             unk
  02 22 00          unk
  01 01             unk
  00                unk
  A0                Collection (Physical)
  32 09 04            unk
  00                  unk
  00                  unk
  01 03               unk
  01 02               unk
  00                  unk
  09 21               Usage (unk)
  11 01               unk
  00                  unk
  01 22               unk
  42 00 07            unk
  05 81               Usage Page (USB Monitor Enumerated Values)
  03 06 00 0A 04      unk
  03 09 04 2E 03      unk
  20                  unk
  00                  unk
  55 00               Unit Exponent (0x00: 0)
        unk
Data (HexDump)           : 12 01 10 01 00 00 00 08 00 00 25 38 00 01 00 01   ..........%8....
                           00 01 09 02 22 00 01 01 00 A0 32 09 04 00 00 01   ....".....2.....
                           03 01 02 00 09 21 11 01 00 01 22 42 00 07 05 81   .....!...."B....
                           03 06 00 0A 04 03 09 04 2E 03 20 00 55 00 53 00   .......... .U.S.
                           42 00                                             B.

        ----------------- Endpoint Descriptor -----------------
bLength                  : 0x07 (7 bytes)
bDescriptorType          : 0x05 (Endpoint Descriptor)
bEndpointAddress         : 0x81 (Direction=IN EndpointID=1)
bmAttributes             : 0x03 (TransferType=Interrupt)
wMaxPacketSize           : 0x0006
bInterval                : 0x0A (10 ms)
Data (HexDump)           : 07 05 81 03 06 00 0A                              .......

      -------------------- String Descriptors -------------------
             ------ String Descriptor 0 ------
bLength                  : 0x04 (4 bytes)
bDescriptorType          : 0x03 (String Descriptor)
Language ID[0]           : 0x0409 (English - United States)
Data (HexDump)           : 04 03 09 04                                       ....
             ------ String Descriptor 1 ------
bLength                  : 0x2E (46 bytes)
bDescriptorType          : 0x03 (String Descriptor)
Language 0x0409          : " USB OPTICAL MOUSE°°°°"  *!*CAUTION  leading space character  *!*ERROR  contains 4 NULL characters
Data (HexDump)           : 2E 03 20 00 55 00 53 00 42 00 20 00 4F 00 50 00   .. .U.S.B. .O.P.
                           54 00 49 00 43 00 41 00 4C 00 20 00 4D 00 4F 00   T.I.C.A.L. .M.O.
                           55 00 53 00 45 00 00 00 00 00 00 00 00 00         U.S.E.........

        +++++++++++++++++ Device Information ++++++++++++++++++
Device Description       : HID-совместимая мышь
Device Path 1            : \\?\HID#VID_0000&PID_3825#7&332b741b&0&0000#{378de44c-56ef-11d1-bc8c-00a0c91405dd} (GUID_DEVINTERFACE_MOUSE)
Device Path 2            : \\?\HID#VID_0000&PID_3825#7&332b741b&0&0000#{4d1e55b2-f16f-11cf-88cb-001111000030} (GUID_DEVINTERFACE_HID)
Kernel Name              : \Device\00000fb6
Device ID                : HID\VID_0000&PID_3825\7&332B741B&0&0000
Hardware IDs             : HID\VID_0000&PID_3825&REV_0100 HID\VID_0000&PID_3825 HID_DEVICE_SYSTEM_MOUSE HID_DEVICE_UP:0001_U:0002 HID_DEVICE
Driver KeyName           : {4d36e96f-e325-11ce-bfc1-08002be10318}\0023 (GUID_DEVCLASS_MOUSE)
Driver                   : \SystemRoot\System32\drivers\mouhid.sys (Version: 10.0.26100.1150  Date: 2025-11-06  Company: Microsoft Corporation)
Driver Inf               : C:\WINDOWS\inf\msmouse.inf
Legacy BusType           : PNPBus
Class                    : Mouse
Class GUID               : {4d36e96f-e325-11ce-bfc1-08002be10318} (GUID_DEVCLASS_MOUSE)
Service                  : mouhid
Enumerator               : HID
Location Info            : -
Address                  : 1
Manufacturer Info        : Microsoft
Capabilities             : 0xA0 (SilentInstall, SurpriseRemovalOK)
Status                   : 0x0180200A (DN_DRIVER_LOADED, DN_STARTED, DN_DISABLEABLE, DN_NT_ENUMERATOR, DN_NT_DRIVER)
Problem Code             : 0
EnhancedPowerMgmtEnabled : 0
Power State              : D0 (supported: D0, D1, D2, D3, wake from D0, wake from D1, wake from D2)

             +++++++++++++ Mouse Information ++++++++++++++
Input Data Queue Length  : 2
Mouse Identifier         : 256
Number of Buttons        : 3
Sample Rate              : 0

             ++++++++++++++ HID Information +++++++++++++++
Product                  : USB OPTICAL MOUSE
UsagePage                : 0x01 (Generic Desktop Controls)
Usage                    : 0x02 (Mouse)
