
    =========================== USB Port2 ===========================

Connection Status        : 0x01 (Device is connected)
Port Chain               : 2-2
Properties               : 0x01
 IsUserConnectable       : yes
 PortIsDebugCapable      : no
 PortHasMultiCompanions  : no
 PortConnectorIsTypeC    : no
ConnectionIndex          : 0x02 (Port 2)
CompanionIndex           : 0
 CompanionHubSymLnk      : USB#ROOT_HUB30#5&315b279c&0&0#{f18a0e88-c30c-11d0-8815-00a0c906bed8}
 CompanionPortNumber     : 0x06 (Port 6)
 -> CompanionPortChain   : 2-6

      ========================== Summary =========================
Vendor ID                : 0x045E (Microsoft Corporation)
Product ID               : 0x02D1
Manufacturer String      : "Microsoft"
Product String           : "Controller"
Serial                   : "7EED839966CD"
USB Version              : 2.0 (but 12 Mbit/s FullSpeed only)
Port maximum Speed       : High-Speed (Companion Port 2-6 is doing the SuperSpeed)
Device maximum Speed     : Full-Speed
Device Connection Speed  : Full-Speed
Self powered             : no
Demanded Current         : 500 mA
Used Endpoints           : 3

      ======================== USB Device ========================

        +++++++++++++++++ Device Information ++++++++++++++++++
Device Description       : Контроллер Xbox One
Device Path 1            : \\?\USB#VID_045E&PID_02D1#7EED839966CD#{a5dcbf10-6530-11d2-901f-00c04fb951ed} (GUID_DEVINTERFACE_USB_DEVICE)
Device Path 2            : \\?\USB#VID_045E&PID_02D1#7EED839966CD#{267c666d-47ce-4c13-9b8c-787192cb387e}
Device Path 3            : \\?\USB#VID_045E&PID_02D1#7EED839966CD#{a6782bce-4376-4de2-8096-70aa9e8fed19}
Device Path 4            : \\?\USB#VID_045E&PID_02D1#7EED839966CD#{020bc73c-0dca-4ee3-96d5-ab006ada5938}
Kernel Name              : \Device\USBPDO-62
Device ID                : USB\VID_045E&PID_02D1\7EED839966CD
Hardware IDs             : USB\VID_045E&PID_02D1&REV_0101 USB\VID_045E&PID_02D1
Driver KeyName           : {05f5cfe2-4733-4950-a6bb-07aad01a3a84}\0000
Driver                   : \SystemRoot\System32\drivers\dc1-controller.sys (Version: 1.0.0.1  Date: 2025-11-06  Company: Microsoft Corp.)
Driver Inf               : C:\WINDOWS\inf\dc1-controller.inf
Legacy BusType           : PNPBus
Class                    : XboxComposite
Class GUID               : {05f5cfe2-4733-4950-a6bb-07aad01a3a84}
Service                  : dc1-controller
Enumerator               : USB
Location Info            : Port_#0002.Hub_#0001
Address                  : 2
Location IDs             : PCIROOT(0)#PCI(0801)#PCI(0003)#USBROOT(0)#USB(2), ACPI(_SB_)#ACPI(PCI0)#ACPI(GP17)#ACPI(XHC0)#ACPI(RHUB)#ACPI(PRT2)
Container ID             : {ec5284fc-b3dd-514c-9b02-9af9312521f9}
Manufacturer Info        : Microsoft
Capabilities             : 0x94 (Removable, UniqueID, SurpriseRemovalOK)
Status                   : 0x0180600A (DN_DRIVER_LOADED, DN_STARTED, DN_DISABLEABLE, DN_REMOVABLE, DN_NT_ENUMERATOR, DN_NT_DRIVER)
Problem Code             : 0
Upper Filters            : xboxgip
EnhancedPowerMgmtEnabled : 0
IdleInWorkingState       : 1
WakeFromSleepState       : 1
Power State              : D0 (supported: D0, D1, D2, D3, wake from D0, wake from D1, wake from D2)

        +++++++++++++++++ Registry USB Flags +++++++++++++++++
HKEY_LOCAL_MACHINE\SYSTEM\CurrentControlSet\Control\usbflags\045E02D10101
 osvc                    : REG_BINARY 01 90
 SkipContainerIdQuery    : REG_BINARY 01 00

        ---------------- Connection Information ---------------
Connection Index         : 0x02 (Port 2)
Connection Status        : 0x01 (DeviceConnected)
Current Config Value     : 0x01 (Configuration 1)
Device Address           : 0x05 (5)
Is Hub                   : 0x00 (no)
Device Bus Speed         : 0x01 (Full-Speed)
Number of open Pipes     : 0x02 (2 pipes to data endpoints)
Pipe[0]                  : EndpointID=1  Direction=OUT  ScheduleOffset=0  Type=Interrupt  wMaxPacketSize=0x40    bInterval=4   -> 718 Bits/ms = 89750 Bytes/s
Pipe[1]                  : EndpointID=1  Direction=IN   ScheduleOffset=0  Type=Interrupt  wMaxPacketSize=0x40    bInterval=4   -> 718 Bits/ms = 89750 Bytes/s
Data (HexDump)           : 02 00 00 00 12 01 00 02 FF 47 D0 40 5E 04 D1 02   .........G.@^...
                           01 01 01 02 03 01 01 01 00 05 00 02 00 00 00 01   ................
                           00 00 00 07 05 01 03 40 00 04 00 00 00 00 07 05   .......@........
                           81 03 40 00 04 00 00 00 00                        ..@......

        --------------- Connection Information V2 -------------
Connection Index         : 0x02 (2)
Length                   : 0x10 (16 bytes)
SupportedUsbProtocols    : 0x03
 Usb110                  : 1 (yes, port supports USB 1.1)
 Usb200                  : 1 (yes, port supports USB 2.0)
 Usb300                  : 0 (no, port not supports USB 3.0) -> but Companion Port 2-6 does
 ReservedMBZ             : 0x00
Flags                    : 0x00
 DevIsOpAtSsOrHigher     : 0 (Device is not operating at SuperSpeed or higher)
 DevIsSsCapOrHigher      : 0 (Device is not SuperSpeed capable or higher)
 DevIsOpAtSsPlusOrHigher : 0 (Device is not operating at SuperSpeedPlus or higher)
 DevIsSsPlusCapOrHigher  : 0 (Device is not SuperSpeedPlus capable or higher)
 ReservedMBZ             : 0x00
Data (HexDump)           : 02 00 00 00 10 00 00 00 03 00 00 00 00 00 00 00   ................

    ---------------------- Device Descriptor ----------------------
bLength                  : 0x12 (18 bytes)
bDescriptorType          : 0x01 (Device Descriptor)
bcdUSB                   : 0x200 (USB Version 2.0) -> but device is Full-Speed only
bDeviceClass             : 0xFF (Vendor Specific)
bDeviceSubClass          : 0x47
bDeviceProtocol          : 0xD0
bMaxPacketSize0          : 0x40 (64 bytes)
idVendor                 : 0x045E (Microsoft Corporation)
idProduct                : 0x02D1
bcdDevice                : 0x0101
iManufacturer            : 0x01 (String Descriptor 1)
 Language 0x0409         : "Microsoft"
iProduct                 : 0x02 (String Descriptor 2)
 Language 0x0409         : "Controller"
iSerialNumber            : 0x03 (String Descriptor 3)
 Language 0x0409         : "7EED839966CD"
bNumConfigurations       : 0x01 (1 Configuration)
Data (HexDump)           : 12 01 00 02 FF 47 D0 40 5E 04 D1 02 01 01 01 02   .....G.@^.......
                           03 01                                             ..

    ------------------ Configuration Descriptor -------------------
bLength                  : 0x09 (9 bytes)
bDescriptorType          : 0x02 (Configuration Descriptor)
wTotalLength             : 0x0060 (96 bytes)
bNumInterfaces           : 0x03 (3 Interfaces)
bConfigurationValue      : 0x01 (Configuration 1)
iConfiguration           : 0x00 (No String Descriptor)
bmAttributes             : 0xA0
 D7: Reserved, set 1     : 0x01
 D6: Self Powered        : 0x00 (no)
 D5: Remote Wakeup       : 0x01 (yes)
 D4..0: Reserved, set 0  : 0x00
MaxPower                 : 0xFA (500 mA)
Data (HexDump)           : 09 02 60 00 03 01 00 A0 FA 09 04 00 00 02 FF 47   ..`............G
                           D0 00 07 05 01 03 40 00 04 07 05 81 03 40 00 04   ......@......@..
                           09 04 01 00 00 FF 47 D0 00 09 04 01 01 02 FF 47   ......G........G
                           D0 00 07 05 02 01 E4 00 01 07 05 82 01 E4 00 01   ................
                           09 04 02 00 00 FF 47 D0 00 09 04 02 01 02 FF 47   ......G........G
                           D0 00 07 05 03 02 40 00 00 07 05 83 02 40 00 00   ......@......@..

        ---------------- Interface Descriptor -----------------
bLength                  : 0x09 (9 bytes)
bDescriptorType          : 0x04 (Interface Descriptor)
bInterfaceNumber         : 0x00 (Interface 0)
bAlternateSetting        : 0x00
bNumEndpoints            : 0x02 (2 Endpoints)
bInterfaceClass          : 0xFF (Vendor Specific)
bInterfaceSubClass       : 0x47
bInterfaceProtocol       : 0xD0
iInterface               : 0x00 (No String Descriptor)
Data (HexDump)           : 09 04 00 00 02 FF 47 D0 00                        ......G..

        ----------------- Endpoint Descriptor -----------------
bLength                  : 0x07 (7 bytes)
bDescriptorType          : 0x05 (Endpoint Descriptor)
bEndpointAddress         : 0x01 (Direction=OUT EndpointID=1)
bmAttributes             : 0x03 (TransferType=Interrupt)
wMaxPacketSize           : 0x0040 (64 bytes)
bInterval                : 0x04 (4 ms)
Data (HexDump)           : 07 05 01 03 40 00 04                              ....@..

        ----------------- Endpoint Descriptor -----------------
bLength                  : 0x07 (7 bytes)
bDescriptorType          : 0x05 (Endpoint Descriptor)
bEndpointAddress         : 0x81 (Direction=IN EndpointID=1)
bmAttributes             : 0x03 (TransferType=Interrupt)
wMaxPacketSize           : 0x0040 (64 bytes)
bInterval                : 0x04 (4 ms)
Data (HexDump)           : 07 05 81 03 40 00 04                              ....@..

        ---------------- Interface Descriptor -----------------
bLength                  : 0x09 (9 bytes)
bDescriptorType          : 0x04 (Interface Descriptor)
bInterfaceNumber         : 0x01 (Interface 1)
bAlternateSetting        : 0x00
bNumEndpoints            : 0x00 (Default Control Pipe only)
bInterfaceClass          : 0xFF (Vendor Specific)
bInterfaceSubClass       : 0x47
bInterfaceProtocol       : 0xD0
iInterface               : 0x00 (No String Descriptor)
Data (HexDump)           : 09 04 01 00 00 FF 47 D0 00                        ......G..

        ---------------- Interface Descriptor -----------------
bLength                  : 0x09 (9 bytes)
bDescriptorType          : 0x04 (Interface Descriptor)
bInterfaceNumber         : 0x01 (Interface 1)
bAlternateSetting        : 0x01
bNumEndpoints            : 0x02 (2 Endpoints)
bInterfaceClass          : 0xFF (Vendor Specific)
bInterfaceSubClass       : 0x47
bInterfaceProtocol       : 0xD0
iInterface               : 0x00 (No String Descriptor)
Data (HexDump)           : 09 04 01 01 02 FF 47 D0 00                        ......G..

        ----------------- Endpoint Descriptor -----------------
bLength                  : 0x07 (7 bytes)
bDescriptorType          : 0x05 (Endpoint Descriptor)
bEndpointAddress         : 0x02 (Direction=OUT EndpointID=2)
bmAttributes             : 0x01 (TransferType=Isochronous  SyncType=None  EndpointType=Data)
wMaxPacketSize           : 0x00E4 (228 bytes)
bInterval                : 0x01 (1 ms)
Data (HexDump)           : 07 05 02 01 E4 00 01                              .......

        ----------------- Endpoint Descriptor -----------------
bLength                  : 0x07 (7 bytes)
bDescriptorType          : 0x05 (Endpoint Descriptor)
bEndpointAddress         : 0x82 (Direction=IN EndpointID=2)
bmAttributes             : 0x01 (TransferType=Isochronous  SyncType=None  EndpointType=Data)
wMaxPacketSize           : 0x00E4 (228 bytes)
bInterval                : 0x01 (1 ms)
Data (HexDump)           : 07 05 82 01 E4 00 01                              .......

        ---------------- Interface Descriptor -----------------
bLength                  : 0x09 (9 bytes)
bDescriptorType          : 0x04 (Interface Descriptor)
bInterfaceNumber         : 0x02 (Interface 2)
bAlternateSetting        : 0x00
bNumEndpoints            : 0x00 (Default Control Pipe only)
bInterfaceClass          : 0xFF (Vendor Specific)
bInterfaceSubClass       : 0x47
bInterfaceProtocol       : 0xD0
iInterface               : 0x00 (No String Descriptor)
Data (HexDump)           : 09 04 02 00 00 FF 47 D0 00                        ......G..

        ---------------- Interface Descriptor -----------------
bLength                  : 0x09 (9 bytes)
bDescriptorType          : 0x04 (Interface Descriptor)
bInterfaceNumber         : 0x02 (Interface 2)
bAlternateSetting        : 0x01
bNumEndpoints            : 0x02 (2 Endpoints)
bInterfaceClass          : 0xFF (Vendor Specific)
bInterfaceSubClass       : 0x47
bInterfaceProtocol       : 0xD0
iInterface               : 0x00 (No String Descriptor)
Data (HexDump)           : 09 04 02 01 02 FF 47 D0 00                        ......G..

        ----------------- Endpoint Descriptor -----------------
bLength                  : 0x07 (7 bytes)
bDescriptorType          : 0x05 (Endpoint Descriptor)
bEndpointAddress         : 0x03 (Direction=OUT EndpointID=3)
bmAttributes             : 0x02 (TransferType=Bulk)
wMaxPacketSize           : 0x0040 (64 bytes)
bInterval                : 0x00 (ignored)
Data (HexDump)           : 07 05 03 02 40 00 00                              ....@..

        ----------------- Endpoint Descriptor -----------------
bLength                  : 0x07 (7 bytes)
bDescriptorType          : 0x05 (Endpoint Descriptor)
bEndpointAddress         : 0x83 (Direction=IN EndpointID=3)
bmAttributes             : 0x02 (TransferType=Bulk)
wMaxPacketSize           : 0x0040 (64 bytes)
bInterval                : 0x00 (ignored)
Data (HexDump)           : 07 05 83 02 40 00 00                              ....@..

    ----------------- Device Qualifier Descriptor -----------------
Error                    : ERROR_GEN_FAILURE  (because the device is Full-Speed only)

      -------------------- String Descriptors -------------------
             ------ String Descriptor 0 ------
bLength                  : 0x04 (4 bytes)
bDescriptorType          : 0x03 (String Descriptor)
Language ID[0]           : 0x0409 (English - United States)
Data (HexDump)           : 04 03 09 04                                       ....
             ------ String Descriptor 1 ------
bLength                  : 0x14 (20 bytes)
bDescriptorType          : 0x03 (String Descriptor)
Language 0x0409          : "Microsoft"
Data (HexDump)           : 14 03 4D 00 69 00 63 00 72 00 6F 00 73 00 6F 00   ..M.i.c.r.o.s.o.
                           66 00 74 00                                       f.t.
             ------ String Descriptor 2 ------
bLength                  : 0x16 (22 bytes)
bDescriptorType          : 0x03 (String Descriptor)
Language 0x0409          : "Controller"
Data (HexDump)           : 16 03 43 00 6F 00 6E 00 74 00 72 00 6F 00 6C 00   ..C.o.n.t.r.o.l.
                           6C 00 65 00 72 00                                 l.e.r.
             ------ String Descriptor 3 ------
bLength                  : 0x1A (26 bytes)
bDescriptorType          : 0x03 (String Descriptor)
Language 0x0409          : "7EED839966CD"
Data (HexDump)           : 1A 03 37 00 45 00 45 00 44 00 38 00 33 00 39 00   ..7.E.E.D.8.3.9.
                           39 00 36 00 36 00 43 00 44 00                     9.6.6.C.D.
             ------ String Descriptor 4 ------
bLength                  : 0x22 (34 bytes)
bDescriptorType          : 0x03 (String Descriptor)
Language 0x0409          : "Bad String Index"
Data (HexDump)           : 22 03 42 00 61 00 64 00 20 00 53 00 74 00 72 00   ".B.a.d. .S.t.r.
                           69 00 6E 00 67 00 20 00 49 00 6E 00 64 00 65 00   i.n.g. .I.n.d.e.
                           78 00                                             x.
             ------ String Descriptor 5 ------
bLength                  : 0x22 (34 bytes)
bDescriptorType          : 0x03 (String Descriptor)
Language 0x0409          : "Bad String Index"
Data (HexDump)           : 22 03 42 00 61 00 64 00 20 00 53 00 74 00 72 00   ".B.a.d. .S.t.r.
                           69 00 6E 00 67 00 20 00 49 00 6E 00 64 00 65 00   i.n.g. .I.n.d.e.
                           78 00                                             x.
             ------ String Descriptor 6 ------
bLength                  : 0x22 (34 bytes)
bDescriptorType          : 0x03 (String Descriptor)
Language 0x0409          : "Bad String Index"
Data (HexDump)           : 22 03 42 00 61 00 64 00 20 00 53 00 74 00 72 00   ".B.a.d. .S.t.r.
                           69 00 6E 00 67 00 20 00 49 00 6E 00 64 00 65 00   i.n.g. .I.n.d.e.
                           78 00                                             x.
             -- MSFT String Descriptor 0xEE --
bLength                  : 0x12 (18 bytes)
bDescriptorType          : 0x03 (String Descriptor)
qwSignature Lang 0x0409  : "MSFT100"
bMS_VendorCode           : 0x90 (GET_MS_DESCRIPTOR=0x90)
bPad                     : 0x00
Data (HexDump)           : 12 03 4D 00 53 00 46 00 54 00 31 00 30 00 30 00   ..M.S.F.T.1.0.0.
                           90 00                                             ..

        +++++++++++++++++ Device Information ++++++++++++++++++
Device Description       : USB-устройство ввода
Kernel Name (PDO)        : \Device\00000f28
Device ID                : USB\VID_045E&PID_02FF&IG_00\00&00&0000CD669983ED7E
Hardware IDs             : USB\VID_045E&PID_02FF&IG_00
Driver KeyName           : {745a17a0-74d3-11d0-b6fe-00a0c90f57da}\0078 (GUID_DEVCLASS_HIDCLASS)
Driver                   : \SystemRoot\System32\drivers\hidusb.sys (Version: 10.0.26100.7262  Date: 2025-11-18  Company: Microsoft Corporation)
Driver Inf               : C:\WINDOWS\inf\input.inf
Legacy BusType           : Internal
Class                    : HIDClass
Class GUID               : {745a17a0-74d3-11d0-b6fe-00a0c90f57da} (GUID_DEVCLASS_HIDCLASS)
Service                  : HidUsb
Enumerator               : USB
Location Info            : -
Address                  : 4294967295 (0xFFFFFFFF)
Manufacturer Info        : (Стандартные системные устройства)
Capabilities             : 0x90 (UniqueID, SurpriseRemovalOK)
Status                   : 0x0180200A (DN_DRIVER_LOADED, DN_STARTED, DN_DISABLEABLE, DN_NT_ENUMERATOR, DN_NT_DRIVER)
Problem Code             : 0
SelectiveSuspendEnabled  : 0
EnhancedPowerMgmtEnabled : 1
Power State              : D0 (supported: D0, D3, wake from D0)

        +++++++++++++++++ Device Information ++++++++++++++++++
Device Description       : Устройство HID, совместимое с XINPUT
Device Path 1            : \\?\HID#VID_045E&PID_02FF&IG_00#8&2a9a63c8&0&0000#{ec87f1e3-c13b-4100-b5f7-8b84d54260cb}
Device Path 2            : \\?\HID#VID_045E&PID_02FF&IG_00#8&2a9a63c8&0&0000#{4d1e55b2-f16f-11cf-88cb-001111000030} (GUID_DEVINTERFACE_HID)
Kernel Name              : \Device\00000f29
Device ID                : HID\VID_045E&PID_02FF&IG_00\8&2A9A63C8&0&0000
Hardware IDs             : HID\VID_045E&PID_02FF&IG_00 HID\VID_045E&UP:0001_U:0005 HID_DEVICE_SYSTEM_GAME HID_DEVICE_UP:0001_U:0005 HID_DEVICE
Driver KeyName           : {745a17a0-74d3-11d0-b6fe-00a0c90f57da}\0079 (GUID_DEVCLASS_HIDCLASS)
Driver Inf               : C:\WINDOWS\inf\xinputhid.inf
Legacy BusType           : PNPBus
Class                    : HIDClass
Class GUID               : {745a17a0-74d3-11d0-b6fe-00a0c90f57da} (GUID_DEVCLASS_HIDCLASS)
Enumerator               : HID
Location Info            : -
Address                  : 1
Manufacturer Info        : Microsoft
Capabilities             : 0xE0 (SilentInstall, RawDeviceOK, SurpriseRemovalOK)
Status                   : 0x0180200A (DN_DRIVER_LOADED, DN_STARTED, DN_DISABLEABLE, DN_NT_ENUMERATOR, DN_NT_DRIVER)
Problem Code             : 0
Upper Filters            : xinputhid
EnhancedPowerMgmtEnabled : 0
Power State              : D0 (supported: D0, D3, wake from D0)

             ++++++++++++++ HID Information +++++++++++++++
Product                  : Controller (Xbox One For Windows)
UsagePage                : 0x01 (Generic Desktop Controls)
Usage                    : 0x05 (Gamepad)
